library,source,description,fog_index
resolve-dir,top,"Resolve a directory that is either local, global or in the user's home directory.",11.314285714285715
right-align,top,Right-align the text in a string.,9.066666666666668
stack-utils,top,Captures and cleans stack traces.,2.0
websocket-extensions-node,top,Generic extension management for WebSocket connections,35.733333333333334
colormin,top,Turn a CSS color into its smallest representation.,8.200000000000001
set-immediate-shim,top,Simple `setImmediate` shim,14.533333333333335
detect-newline,top,Detect the dominant newline character of a string,13.200000000000001
engine.io-parser,top,"Parser for the engine.io protocol, used by client and server",6.0
pumpify,top,Combine an array of streams into a single duplex stream using pump and duplexify,8.457142857142857
redux,top,A JS library for predictable global state management,13.200000000000001
is-ci,top,Detect if the current environment is a CI server,8.044444444444444
copy-webpack-plugin,top,Copy files and directories with webpack,9.066666666666668
csstree,top,"A tool set for CSS including fast detailed parser, walker, generator and lexer based on W3C specs and browser implementations",14.0
uglifyjs-webpack-plugin,top,[deprecated] UglifyJS Plugin,14.533333333333335
postcss-modules-local-by-default,top,PostCSS plugin for css modules to local-scope classes and ids,4.0
url-parse,top,Small footprint URL parser that works seamlessly across Node.js and browser environments.,9.066666666666668
querystringify,top,"Querystringify - Small, simple but powerful query string parser.",8.200000000000001
postcss-modules-values,top,Pass arbitrary constants between your module files,8.514285714285714
cross-env,top,ðŸ”€ Cross platform setting of environment scripts,9.066666666666668
icss-utils,top,Search & replace tokens during the linking stage of ICSS loading,4.0
multicast-dns,top,Low level multicast-dns implementation in pure javascript,19.942857142857143
sort-keys,top,Sort the keys of an object,2.4000000000000004
contains-path,top,Return true if a file path contains the given path.,4.0
dns-packet,top,An abstract-encoding compliant module for encoding / decoding DNS packets,21.37777777777778
array-differ,top,Create an array with values that are present in the first input array but not additional ones,9.15294117647059
homedir-polyfill,top,Node.js os.homedir polyfill for older versions of node.js.,8.200000000000001
to-arraybuffer,top,Get an ArrayBuffer from a Buffer as fast as possible,8.0
num2fraction,top,Converting Number to Fraction with Node.js,9.066666666666668
css-declaration-sorter,top,Sort CSS declarations fast and automatically in a certain order.,12.0
requires-port,top,Check if a protocol requires a certain port number to be added to an URL.,11.333333333333336
neo-async,top,"Neo-Async is thought to be used as a drop-in replacement for Async, it almost fully covers its functionality and runs faster",12.20952380952381
lowercase-keys,top,Lowercase the keys of an object,9.066666666666668
get-value,top,Use property paths (`a.b.c`) get a nested value from an object.,5.836363636363637
source-list-map,top,Fast line to line SourceMap generator.,9.066666666666668
normalize-range,top,"normalize a ranged value that wraps. ( i.e. angular range [0-360), where 400 === 40 and -20 === 340)",8.200000000000001
relateurl,top,Create a relative URL with options to minify.,8.200000000000001
has-value,top,"Returns true if a value exists, false if empty. Works with deeply nested values using object paths.",3.4000000000000004
multicast-dns-service-types,top,Parse and stringify mdns service types,2.4000000000000004
internal-ip,top,Get your internal IP address,10.0
global-modules,top,Returns the directory used by NPM for globally installed NPM packages.,15.30909090909091
is-descriptor,top,Returns true if a value has the characteristics of a valid JavaScript descriptor. Works for data descriptors and accessor descriptors.,16.0
react-redux,top,Official React bindings for Redux,10.0
html-comment-regex,top,Regular expression for matching HTML comments,15.733333333333334
hoist-non-react-statics,top,Copies non-react specific statics from a child component to a parent component,18.133333333333336
socket.io-adapter,top,The Socket.IO in-memory adapter,31.6
capture-stack-trace,top,Ponyfill for Error#captureStackTrace,14.533333333333335
time-stamp,top,"Get a formatted timestamp. Used in gulp, assemble, generate, and many others.",12.4
reduce-css-calc,top,Reduce CSS calc() function at the maximum,8.514285714285714
latest-version,top,Get the latest version of an npm package,3.2
generate-function,top,Module that helps you write generated functions in Node,8.044444444444444
is-my-json-valid,top,A JSONSchema validator that uses code generation to be extremely fast,15.30909090909091
flush-write-stream,top,A write stream constructor that supports a flush function that is called before finish is emitted,11.4
object-visit,top,Call the given method on each value in the given object.,4.4
package-json,top,Get metadata of a package from the npm registry,12.488888888888889
gzip-size,top,Get the gzipped size of a string or buffer,3.6
webpack-merge,top,Merge designed for webpack,1.6
postcss-filter-plugins,top,Exclude/warn on duplicated PostCSS plugins.,18.0
snapdragon,top,"snapdragon is an extremely pluggable, powerful and easy-to-use parser-renderer factory.",16.0
leven,top,Measure the difference between two strings with the fastest JS implementation of the Levenshtein distance algorithm,13.9
reduce-function-call,top,"Reduce function calls in a string, using a callback",3.6
use,top,Easily add plugin support to your node.js application. ,13.200000000000001
dns-txt,top,Encode/decode DNS-SD TXT record RDATA fields,9.066666666666668
arraybuffer.slice,top,Exports a function for slicing ArrayBuffer without polyfilling,13.200000000000001
clone-deep,top,"Recursively (deep) clone JavaScript native types, like Object, Array, RegExp, Date as well as primitives. Used by superstruct, merge-deep, and many others!",11.672727272727274
gulp-sourcemaps,top,Sourcemap support for gulpjs.,1.6
nth-check,top,Parses and compiles CSS nth-checks to highly optimized functions.,8.044444444444444
serve-favicon,top,favicon serving middleware,27.86666666666667
detect-file,top,"Uses a breadth-first search, when necessary, to resolve the file path using the correct casing, and verify that the file actually exists. Returns consistent results regardless of case sensitivity of the file path and/or operating system.",14.977777777777778
dir-glob,top,Convert directories to glob compatible strings,15.733333333333334
mississippi,top,A collection of useful stream utility modules for writing better code using streams,11.353846153846156
js-symbol-tree,top,Turn any collection of objects into its own efficient tree or linked list using Symbol,11.333333333333336
postcss-message-helpers,top,PostCSS helpers to throw or output GNU style messages,8.044444444444444
pretty-bytes,top,Convert bytes to a human readable string: 1337 â†’ 1.34 kB,8.0
session,top,Simple session middleware for Express,10.0
xml-name-validator,top,Validates whether a string matches the production for an XML name or qualified name,14.171428571428573
original,top,Generate the origin from an URL or check if two URL/Origins are the same.,14.171428571428573
string-length,top,Get the real length of a string - by correctly counting astral symbols and ignoring ansi escape codes,11.505882352941178
sane,top,"sane aims to be fast, small, and reliable filesystem watcher. No bells and whistles, just change events.",5.752941176470589
strict-uri-encode,top,A stricter URI encode adhering to RFC 3986,8.200000000000001
array-slice,top,"Lo-dash's array-clice method. Slices `array` from the `start` index up to, but not including, the `end` index.",5.752941176470589
is-npm,top,Check if your code is running as an npm or yarn script,4.800000000000001
node-klaw,top,A Node.js file system walker with a Readable stream interface. Extracted from fs-extra.,11.830769230769231
require-from-string,top,Load module from string,1.6
vue-loader,top,ðŸ“¦ Webpack loader for Vue.js components,10.0
ansi-colors,top,"Easily add ANSI colors to your text and symbols in the terminal. ansi-colors is the official ansi styling library for gulp. Used by hundreds of projects, including enquirer, vscode, codeql, azure data studio, aws-cdk, redwoodjs, leaflet, mocha, and many others.",14.333333333333336
semver-diff,top,Get the diff type of two semver versions: 0.0.1 0.0.2 â†’ patch,4.4
xdg-basedir,top,Get XDG Base Directory paths,10.0
offset-buffer,top,,0.0
registry-url,top,Get the set npm registry URL,9.066666666666668
postcss-custom-properties,top,Use Custom Properties in CSS,10.0
uniqs,top,Tiny utility to de-duplicate lists,18.0
spdy-transport,top,"SPDY v2, v3, v3.1 and HTTP2 transport implementation for node.js",6.0
eslint-config-standard,top,ESLint Config for JavaScript Standard Style,9.066666666666668
in-publish,top,Detect if we were run as a result of `npm publish`.,4.4
wbuf,top,,0.0
stdout-stream,top,Non-blocking stdout stream,14.533333333333335
gulp-autoprefixer,top,Prefix CSS,0.8
beeper,top,Make your terminal beep,11.600000000000001
v8flags,top,Get available v8 and Node.js flags.,9.066666666666668
immer,top,Create the next immutable state by mutating the current one,12.0
url-parse-lax,top,url.parse() with support for protocol-less URLs & IPs,8.514285714285714
shallow-clone,top,"Make a shallow clone of an object, array or primitive.",8.0
uniqid,top,Unique ID Generator,14.533333333333335
import-lazy,top,Import a module lazily,11.600000000000001
ast-types-flow,top,Flow types for the Javascript AST,9.066666666666668
should.js,top,BDD style assertions for node.js -- test framework agnostic,11.600000000000001
exit-hook,top,Run some code when the process exits,2.8000000000000003
node-macaddress,top,Get the MAC addresses (hardware addresses) of the hosts network interfaces.,15.30909090909091
webpack-manifest-plugin,top,webpack plugin for generating asset manifests,15.733333333333334
rechoir,top,Prepare a node environment to require files with different extensions.,16.0
sass-graph,top,Parses import dependencies from a directory of sass files,12.488888888888889
node-app-root-path,top,Determine the root path to your project,8.514285714285714
widest-line,top,Get the visual width of the widest line in a string - the number of columns required to display it,11.810526315789474
topo,top,Topological sorting with grouping support,10.0
stackframe,top,JS Object representation of a stack frame. ,8.514285714285714
yeast,top,Tiny but linear growing unique id generator.,14.228571428571428
ip-regex,top,Regular expression for matching IP addresses,22.400000000000002
merge2,top,Merge multiple streams into one stream in sequence or parallel (~119M/month downloads).,11.466666666666669
log-symbols,top,Colored symbols for various log levels,9.066666666666668
strip-comments,top,Strip block comments or line comments from JavaScript code. ,8.044444444444444
from2,top,"Convenience wrapper for ReadableStream, with an API lifted from ""from"" and ""through2""",8.133333333333335
stealthy-require,top,The closest you can get to require something with bypassing the require cache,14.430769230769233
String.prototype.trimLeft,top,ES2019 spec-compliant shim for String.prototype.trimLeft.,18.0
String.prototype.trimRight,top,ES2019 spec-compliant shim for String.prototype.trimRight.,18.0
eslint-plugin-standard,top,ESlint Rules for the Standard Linter,2.4000000000000004
classnames,top,A simple javascript utility for conditionally joining classNames together,16.933333333333334
yn,top,Parse yes/no like values,1.6
ncname,top,Regular expression for matching XML NCName,15.733333333333334
eslint-plugin-node,top,Additional ESLint's rules for Node.js,18.0
void-elements,top,"Object of ""void elements"" as defined by the WHATWG HTML Standard.",8.036363636363637
optimize-css-assets-webpack-plugin,top,A Webpack plugin to optimize \ minimize CSS assets.,13.200000000000001
rollup,top,Next-generation ES module bundler,11.600000000000001
run-sequence,top,Run a series of dependent gulp tasks in order,8.044444444444444
is-odd,top,"I created this in 2014, the year I learned how to program. All of the downloads are from an old version of https://github.com/micromatch/micromatch. I've done a few other things since: https://github.com/jonschlinkert.",8.004301075268819
browser-process-hrtime,top,:watch: Browser shim for Node.js process.hrtime(),2.4000000000000004
glogg,top,Global logging utility.,14.533333333333335
multipipe,top,A better `Stream.pipe` that creates duplex streams and lets you handle errors in one place.,3.0
detect-port,top,Node.js module to detect available ports of the system.,8.044444444444444
first-chunk-stream,top,Transform the first chunk in a stream,2.8000000000000003
webpack-hot-middleware,top,Webpack hot reloading you can attach to your own server,4.0
date-fns,top,â³ Modern JavaScript date utility library âŒ›ï¸,18.0
husky,top,Git hooks made easy ðŸ¶ woof!,2.0
fancy-log,top,"Log things, prefixed with a timestamp.",2.4000000000000004
import-from,top,Import a module like with `require()` but from a given path,8.036363636363637
redux-thunk,top,Thunk middleware for Redux,11.600000000000001
scss-tokenizer,top,A tokenzier for Sass' SCSS syntax,9.066666666666668
is-absolute,top,Returns true if a filepath is absolute. The original path-is-absolute.,14.0
any-promise,top,NOTE: You probably want native promises now,14.228571428571428
is-root,top,"Check if the process is running as root user, for example, one started with `sudo`",8.666666666666668
postcss-initial,top,PostCSS plugin to fallback initial keyword,9.066666666666668
istanbul-instrumenter-loader,top,Istanbul Instrumenter Loader,27.86666666666667
postcss-import,top,PostCSS plugin to inline at-import rules content,2.8000000000000003
method-override,top,Override HTTP verbs.,14.533333333333335
is-relative,top,"Returns `true` if a file path appears to be relative. Moved from the ""relative"" lib.",8.333333333333334
file-type,top,"Detect the file type of a file, stream, or data",4.0
nyc,top,the Istanbul command line interface,18.0
node-pn,top,The Promised Node -- a package which promisifies the node standard library.,4.4
import-cwd,top,Import a module like with `require()` but from the current working directory,11.466666666666669
compare-versions,top,"Compare semver version strings to find which is greater, equal or lesser.",4.800000000000001
friendly-errors-webpack-plugin,top,"Recognizes certain classes of webpack errors and cleans, aggregates and prioritizes them to provide a better Developer Experience.",18.311111111111114
builtins,top,List of node.js builtin modules,1.0
gulp-plumber,top,Fixing Node pipes,1.2000000000000002
browser-stdout,top,:page_with_curl: pipe to console - process.stdout in your browser,6.6000000000000005
stream-each,top,Iterate all the data in a stream,8.514285714285714
postcss-font-variant,top,PostCSS plugin to transform W3C CSS font variant properties to more compatible CSS (font-feature-settings),17.02857142857143
RegExp.prototype.flags,top,ES6 spec-compliant RegExp.prototype.flags shim,21.6
circular-dependency-plugin,top,Detect circular dependencies in modules compiled with Webpack,13.200000000000001
warning,top,A mirror of Facebook's Warning,2.0
gulplog,top,Logger for gulp and gulp plugins.,2.4000000000000004
replace-ext,top,Replaces a file extension with another one.,14.228571428571428
xml-char-classes,top,Regular expressions for matching against the XML Character Classes,16.933333333333334
custom-event,top,Cross-browser `CustomEvent` constructor,27.86666666666667
parse-filepath,top,Parse a filepath and return an object of path parts. Falls back on native node.js `path.parse` if it exists ,2.533333333333333
standard,top,"ðŸŒŸ JavaScript Style Guide, with linter & automatic code fixer",13.200000000000001
laravel-mix,top,"The power of webpack, distilled for the rest of us.",4.0
mixin-object,top,Extend the properties from any number of objects onto the first object. Pass an empty object as the first arg to create a new object.,6.6000000000000005
has-gulplog,top,Check if gulplog is available before attempting to use it,12.0
caller-callsite,top,Get the callsite of the caller function,2.8000000000000003
is-generator-fn,top,Check if something is a generator function,8.514285714285714
pkg-up,top,Find the closest package.json file,10.0
dom-serialize,top,Serializes any DOM node into a String,8.514285714285714
validate-npm-package-name,top,Is the given string an acceptable npm package name?,8.044444444444444
call-me-maybe,top,Let your JS API users either give you a callback or receive a promise,5.6000000000000005
extract-zip,top,Zip extraction written in pure JavaScript. Extracts a zip into a directory. ,12.4
react-hot-loader,top,Tweak React components in real time. (Deprecated: use Fast Refresh instead.),9.472727272727274
yauzl,top,yet another unzip library for node,2.4000000000000004
decompress-response,top,Decompress a HTTP response if needed,9.066666666666668
node-dom-urls,top,A partial implementation of the W3C URL Spec Draft for Node,8.036363636363637
async-each-series,top,Apply an async function to each Array element in series,8.0
babelify,top,Browserify transform for Babel,11.600000000000001
webpack-bundle-analyzer,top,Webpack plugin and CLI utility that represents bundle content as convenient interactive zoomable treemap,17.02857142857143
ansi-wrap,top,Create ansi colors by passing open and close codes.,3.6
flagged-respawn,top,A tool for respawning node binaries when special flags are present.,8.036363636363637
vinyl-source-stream,top,:cyclone: Use conventional text streams at the start of your gulp or vinyl pipelines,8.457142857142857
unc-path-regex,top,Regular expression for testing if a file path is a windows UNC file path. Can also be used as a component of another regexp via the `.source` property.,11.314285714285715
babel-plugin-transform-react-remove-prop-types,top,Remove unnecessary React propTypes from the production build. :balloon:,12.488888888888889
webpack-subresource-integrity,top,Webpack plugin for enabling Subresource Integrity.,22.400000000000002
snapdragon-util,top,Utilities for the snapdragon parser/compiler.,26.0
elixir,top,Fluent API for Gulp.,1.6
postcss-custom-media,top,"Use Custom Media Queries in CSS, following the CSS Media Queries specification",14.8
object.defaults,top,Like `extend` but only copies missing properties/values to the target object.,8.036363636363637
rollup-plugin-node-resolve,top,This module has moved and is now available at @rollup/plugin-node-resolve / https://github.com/rollup/plugins/blob/master/packages/node-resolve,15.30909090909091
color-support,top,A module which will endeavor to guess your terminal's level of color support.,11.353846153846156
postcss-media-minmax,top,Writing simple and graceful Media Queries!,9.066666666666668
postcss-custom-selectors,top,Use Custom Selectors in CSS,10.0
hash-sum,top,:confetti_ball: Blazing fast unique hash generator,15.733333333333334
output-file-sync,top,Synchronously write a file and create its ancestor directories if needed,15.30909090909091
postcss-selector-matches,top,PostCSS plugin to transform :matches() W3C CSS pseudo class to more compatible CSS (simpler selectors),14.0
postcss-selector-not,top,PostCSS plugin to transform :not() W3C CSS level 4 pseudo class to more compatible CSS (multiple css3 :not() selectors),13.915789473684212
fined,top,Find a file given a declaration of locations.,13.200000000000001
karma-webpack,top,Karma webpack Middleware,14.533333333333335
vue-hot-reload-api,top,ðŸŒ¶ï¸ Hot reload API for Vue components,9.066666666666668
is-regexp,top,Check if a value is a regular expression,13.200000000000001
errorhandler,top,Development-only error handler middleware,21.6
denodeify,top,"Standalone denodeify, for all of your callback -> promise needs.  Just drop in an ES6 complaint promise library & stir",5.822222222222223
strong-globalize,middle,"strong-globalize is built on Unicode CLDR and jquery/globalize and implements automatic extraction of strings from JS source code and HTML templates, lint the string resource, machine-translate them in seconds.  In runtime, it loads locale and string resource into memory and provides a hook to persistent logging.",16.156521739130437
angular-router-loader,middle, A Webpack loader that enables string-based module loading with the Angular Router,11.466666666666669
detect-browser,middle,Unpack a browser type and version from the useragent string,8.0
is-online,middle,Check if the internet connection is up,14.228571428571428
vux-loader,middle,hack into vue-loader,1.2000000000000002
gulp-jsonminify,middle,Minifies blocks of JSON-like content into valid JSON by removing all whitespace and comments.,8.457142857142857
loopback-component-passport,middle,LoopBack passport integration to support third party logins and account linking,8.036363636363637
rollup-plugin-babel-minify,middle,Simple rollup plugin for minifying code using babel-preset-minify.,13.200000000000001
gulp-strip-comments,middle,Strips comments from code,1.6
commist,middle,Build your commands on minimist!,2.0
hexo-renderer-jade,middle,Jade renderer for Hexo. Replaced by https://github.com/hexojs/hexo-renderer-pug,12.82857142857143
http,middle,Http assertions for should.js,11.600000000000001
webidl2js,middle,Auto-generate JS class structures for Web IDL specifications,13.200000000000001
heroku-cli-util,middle,Utilities for CLI plugins,11.600000000000001
tslint-ionic-rules,middle,Common TypeScript lint rules/preferences for Ionic.,15.733333333333334
react-beautiful-dnd,middle,Beautiful and accessible drag and drop for lists with React,8.0
node-cmd,middle,Simple commandline interface to allow you to run cli or bash style commands as if you were in the terminal.,14.0
perfectionist,middle,Beautify CSS files.,1.2000000000000002
path-loader,middle,Utility that provides a single API for loading the content of a path/URL.,8.276923076923078
google-libphonenumber,middle,The up-to-date and reliable Google's libphonenumber package for node.js.,16.933333333333334
html-webpack-harddisk-plugin,middle,Write html files to hard disk even when using the webpack dev server or middleware,8.666666666666668
geojson-vt,middle,Slice GeoJSON into vector tiles on the fly in the browser,8.036363636363637
grunt-svgstore,middle,Merge svgs from a folder,2.0
react-share,middle,Social media share buttons and share counts for React,8.044444444444444
node-os,middle,NodeJS Core Module,1.2000000000000002
i18next-xhr-backend,middle,[deprecated] can be replaced with i18next-http-backend,15.733333333333334
cool-ascii-faces,middle,á•™à¼¼àºˆÙ„Íœàºˆà¼½á•—,0.4
koa-connect,middle,Use connect and express middleware in koa,8.514285714285714
modify-babel-preset,middle,:dizzy: Create a modified babel preset based on an an existing preset.,11.466666666666669
gulp-natural-sort,middle,Sort stream by path name using a natural sort,8.044444444444444
express-request-proxy,middle,"Advanced streaming http request proxy middleware for Express with support for custom routes, caching, and response transforms.",9.15294117647059
gulp-hub,middle,Gulp plugin to run tasks in multiple gulpfiles,8.200000000000001
wif,middle,Bitcoin Wallet Import Format JS encoding/decoding module,8.514285714285714
node-app-root-dir,middle,Simple module to infer the root directory of the currently running node application,14.430769230769233
simctl,middle,node.js library for Xcode simctl utility on macOS,8.200000000000001
postcss-parser-tests,middle,Base tests for every PostCSS CSS parser,2.8000000000000003
protractor-jasmine2-screenshot-reporter,middle,Protractor screenshot reporter for Jasmine2,18.0
levenshtein-edit-distance,middle,Levenshtein edit distance,14.533333333333335
node-multispinner,middle,"Multiple, simultaneous, individually controllable spinners for concurrent tasks in Node.js CLI programs",19.066666666666666
react-flip-move,middle,Effortless animation between DOM changes (eg. list reordering) using the FLIP technique.,12.4
react-resizable,middle,A simple React component that is resizable with a handle. ,12.0
changelogx,middle,"Yet another changelog generator from git commits, based on conventions and with an optional hook to enforce the rules",13.915789473684212
resolve-protobuf-schema,middle,"Read a protobuf schema from the disk, parse it and resolve all imports",8.276923076923078
shiro-trie,middle,"Check permissions using Shiro-like strings, put in a trie.",12.488888888888889
concat,middle,ðŸ± concatenate files,20.8
imagemin-cli,middle,Minify images seamlessly,27.86666666666667
gulp-css-inline-images,middle,Wrapper for using css-inline-images in Gulp,9.066666666666668
marko,middle,"A declarative, HTML-based language that makes building web apps fun",8.0
node-parse-numeric-range,middle,"Parses expressions like 1-10,20-30. Returns an energetic array.",11.600000000000001
stream-to-promise,middle,Convert streams (readable or writable) to promises,14.228571428571428
gulp-subtree,middle,A Gulp module to push a given folder to a subtree,4.4
lintspaces-cli,middle,A CLI for the node-lintspaces module.,2.4000000000000004
gl-mat4,middle,"gl-matrix's mat4, split into smaller pieces",2.4000000000000004
react-burger-menu,middle,:hamburger: An off-canvas sidebar component with a collection of effects and styles using CSS transitions and SVG path animations,20.231578947368423
redux-localstorage,middle,Store enhancer that syncs (a subset) of your Redux store state to localstorage.,11.353846153846156
