library,source,description,fog_index
body-parser,top,Node.js body parsing middleware,11.600000000000001
inflight,top,Add callbacks to requests in flight to avoid async duplication,8.0
mime-types,top,The ultimate javascript content-type utility.,34.0
mime-db,top,Media Type Database,27.86666666666667
ansi-regex,top,Regular expression for matching ANSI escape codes,14.228571428571428
color-name,top,A JSON with CSS color names,2.4000000000000004
qs,top,A querystring parser and serializer with nesting support,8.200000000000001
safe-buffer,top,Safer Node.js Buffer API,1.6
node-bcrypt-pbkdf,top,Port of the OpenBSD `bcrypt_pbkdf` function to pure Javascript,12.488888888888889
cliui,top,easily create complex multi-column command-line-interfaces.,26.0
array-flatten,top,Flatten a multi-dimensional array in JavaScript.,15.733333333333334
babel-loader,top,ðŸ“¦ Babel loader for webpack,1.6
aproba,top,A ridiculously light-weight function argument validator,22.400000000000002
string-width,top,Get the visual width of a string - the number of columns required to display it,11.333333333333336
execa,top,Process execution for humans,11.600000000000001
normalize-path,top,"Normalize file path slashes to be unix-like forward slashes. Used by chokidar, anymatch, and many others!",5.7
browserslist,top,"ðŸ¦” Share target browsers between different front-end tools, like Autoprefixer, Stylelint and babel-preset-env",11.466666666666669
ansi-escapes,top,ANSI escape codes for manipulating the terminal,14.228571428571428
wrap-ansi,top,Wordwrap a string with ANSI escape codes,2.8000000000000003
node-sshpk,top,"Parse, convert, fingerprint and use SSH keys in pure node.js",8.0
npm-run-path,top,Get your PATH prepended with locally installed binaries,13.200000000000001
node-cross-spawn,top,A cross platform solution to node's spawn and spawnSync,8.044444444444444
read-pkg-up,top,Read the closest package.json file,10.0
bn.js,top,BigNum in pure javascript,11.600000000000001
define-properties,top,Define multiple non-enumerable properties at once. Uses `Object.defineProperty` when available; falls back to standard assignment in older engines.,16.933333333333334
escape-string-regexp,top,Escape RegExp special characters,11.600000000000001
is-buffer,top,Determine if an object is a Buffer,8.514285714285714
globby,top,User-friendly glob matching,14.533333333333335
camelcase,top,Convert a dash/dot/underscore/space separated string to camelCase: foo-bar â†’ fooBar,12.488888888888889
tweetnacl-js,top,Port of TweetNaCl cryptographic library to JavaScript,19.942857142857143
for-own,top,"Iterate over the own enumerable properties of an object, and return an object with properties that evaluate to true from the callback. Exit early by returning `false`.",14.28888888888889
invariant,top,invariant,40.400000000000006
compression,top,Node.js compression middleware,27.86666666666667
source-map-resolve,top,[DEPRECATED] Resolve the source map and/or sources for a generated file.,11.672727272727274
es-abstract,top,ECMAScript spec abstract operations.,11.600000000000001
braces,top,"Faster brace expansion for node.js. Besides being faster, braces is not subject to DoS attacks like minimatch, is more accurate, and has more complete support for Bash 4.3.",9.885714285714286
has-ansi,top,Check if a string has ANSI escape codes,3.2
assign-symbols,top,"Assign the enumerable es6 Symbol properties from an object (or objects) to the first object passed on the arguments. Can be used as a supplement to other extend, assign or merge methods as a polyfill for the Symbols part of the es6 `Object.assign` method.",13.345454545454544
caniuse-lite,top,"A smaller version of caniuse-db, with only the essentials!",8.044444444444444
es-to-primitive,top,"ECMAScript ""ToPrimitive"" algorithm. Provides ES5 and ES6/ES2015 versions.",11.600000000000001
glob-parent,top,Extract the non-magic parent path from a glob string.,8.044444444444444
to-fast-properties,top,Force V8 to use fast properties for an object,8.044444444444444
isobject,top,"Is the value an object, and not an array or null?",4.4
extend-shallow,top,Extend object A with the properties of object B. node.js/javascript util.,11.672727272727274
array-uniq,top,Create an array without duplicates,10.0
wrappy,top,Callback wrapping utility,14.533333333333335
arr-diff,top,Returns an array with only the unique values from all given arrays using strict equality for comparisons.,11.505882352941178
elliptic,top,Fast Elliptic Curve Cryptography in plain javascript,19.942857142857143
code-point-at,top,ES2015 `String#codePointAt()` ponyfill,14.533333333333335
array-unique,top,Return an array free of duplicate values. Very fast implementation.,10.0
process-nextick-args,top,"process.nextTick always accepts args, always",10.0
find-cache-dir,top,Finds the common standard cache directory,9.066666666666668
arrify,top,Convert a value to an array,2.4000000000000004
mem,top,Memoize functions - an optimization technique used to speed up consecutive function calls by caching the result of calls with identical input,16.019047619047623
parse-json,top,Parse JSON with more helpful errors,2.4000000000000004
del,top,Delete files and directories,11.600000000000001
arr-flatten,top,Recursively flatten an array or arrays. This is the fastest implementation of array flatten.,8.514285714285714
decamelize,top,Convert a camelized string into a lowercased one with a custom separator: unicornRainbow â†’ unicorn_rainbow,17.02857142857143
pify,top,Promisify a callback-style function,11.600000000000001
find-up,top,Find a file or directory by walking up parent directories,12.0
nodejs-depd,top,Deprecate all the things,11.600000000000001
object.pick,top,"(object pick) returns a filtered copy of an object with only the specified keys, exactly like `pick` from lo-dash / underscore.",14.0
builtin-modules,top,A static list of the Node.js builtin modules from the latest Node.js version,2.6
array-union,top,"Create an array of unique values, in order, from the input arrays",4.800000000000001
has-flag,top,Check if argv has a specific flag,8.514285714285714
des.js,top,DES algorithm,20.8
binary-extensions,top,List of binary file extensions,18.0
yargs-parser,top,:muscle: the mighty option parser used by yargs,3.2
http-errors,top,Create HTTP Errors,1.2000000000000002
is-fullwidth-code-point,top,Check if the character represented by a given Unicode code point is fullwidth,11.353846153846156
for-in,top,"Iterate over the enumerable properties of an object, and return an object with properties that evaluate to true from the callback. Exit early by returning `false`.",14.430769230769233
finalhandler,top,Node.js final http responder,11.600000000000001
align-text,top,Align the text in a string. ,2.4000000000000004
pbkdf2,top,PBKDF2 with any supported hashing algorithm in Node,13.200000000000001
fill-range,top,"Fill in a range of numbers or letters, positive or negative, optionally passing an increment or multiplier to use.",18.126315789473683
node-har-validator,top,Extremely fast HTTP Archive (HAR) validator using JSON Schema,12.488888888888889
util-deprecate,top,The Node.js `util.deprecate()` function with browser support,8.514285714285714
etag,top,Create simple HTTP ETags,1.6
watchpack,top,Wrapper library for directory and file watching.,8.514285714285714
lcid,top,Mapping between standard locale identifiers and Windows locale identifiers (LCID),12.0
isexe,top,Minimal module to check if a file is executable.,12.488888888888889
cosmiconfig,top,"Find and load configuration from a package.json property, rc file, TypeScript module, and more!",11.371428571428572
caller-path,top,Get the path of the caller module,2.8000000000000003
camelcase-keys,top,Convert object keys to camel case,2.4000000000000004
pako,top,"high speed zlib port to javascript, works in browser & node.js",8.0
yallist,top,Yet Another Linked List,1.6
is-glob,top,"If you use globs, this will make your code faster. Returns `true` if the given string looks like a glob pattern or an extglob pattern. This makes it easy to create code that only uses external modules like node-glob when necessary, resulting in much faster code execution and initialization time, and a better user experience. 55+ million downloads. ",9.937931034482759
http-proxy-middleware,top,":zap: The one-liner node.js http-proxy middleware for connect, express, next.js and more",8.266666666666667
ci-info,top,Get details about the current Continuous Integration environment ,18.2
loader-runner,top,Runs (webpack) loaders,1.2000000000000002
browserify-aes,top,"aes, for browserify",14.533333333333335
serve-static,top,Serve static files,1.2000000000000002
invert-kv,top,Invert the key/value of an object. Example: {foo: 'bar'} â†’ {bar: 'foo'},9.472727272727274
repeat-string,top,Repeat the given string n times. Fastest implementation for repeating a string (2x faster than the native method),8.044444444444444
micromatch,top,"Highly optimized wildcard and glob matching library. Faster, drop-in replacement to minimatch and multimatch. Used by square, webpack, babel core, yarn, jest, ract-native, taro, bulma, browser-sync, stylelint, nyc, ava, and many others! Follow micromatch's author: https://github.com/jonschlinkert",11.377777777777778
setprototypeof,top,Polyfill for Object.setPrototypeOf,14.533333333333335
expand-range,top,"Faster, bash-like range expansion. Expand a range of numbers or letters, uppercase or lowercase. See the benchmarks.",9.325490196078432
browserify-cipher,top,,0.0
browserify-des,top,DES for browserify,14.533333333333335
browserify-rsa,top,,0.0
browserify-sign,top,createSign and createVerify in your browser,15.733333333333334
figures,top,Unicode symbols with fallbacks for older terminals,8.514285714285714
webpack-sources,top,Source code handling classes for webpack,2.4000000000000004
buffer-xor,top,A simple module for bitwise-xor on buffers,8.514285714285714
shebang-command,top,Get the command from a shebang,2.4000000000000004
spdx-license-ids,top,a list of SPDX license identifiers,9.066666666666668
filename-regex,top,"Regular expression for matching file names, with or without extension.",16.0
is-stream,top,Check if something is a Node.js stream,2.8000000000000003
load-json-file,top,Read and parse a JSON file,2.4000000000000004
cipher-base,top,abstract base class for crypto-streams,2.0
eslint-plugin-import,top,ESLint plugin with rules that help validate proper imports.,8.044444444444444
write-file-atomic,top,Write files in an atomic fashion w/configurable ownership,18.2
createHash,top,"Node style hashes for use in the browser, with native hash functions in node",5.6000000000000005
createHmac,top,"Node style HMAC for use in the browser, with native implementation in node",8.276923076923078
parseurl,top,parse a url with memoization,10.0
normalize-url,top,Normalize a URL,14.533333333333335
statuses,top,HTTP status utility,14.533333333333335
createECDH,top,browserify version of crypto.createECDH,21.6
repeat-element,top,Create an array by repeating the given string n times.,8.0
is-path-inside,top,Check if a path is inside another path,3.2
meow,top,ðŸˆ CLI app helper,1.2000000000000002
media-typer,top,Simple RFC 6838 media type parser and formatter,13.200000000000001
content-type,top,Create and parse HTTP Content-Type header,9.066666666666668
strip-bom,top,Strip UTF-8 byte order mark (BOM) from a string,3.6
is-binary-path,top,Check if a file path is a binary file,8.044444444444444
stream-shift,top,Returns the next buffer/object in a stream's readable queue,12.488888888888889
path-exists,top,Check if a path exists,2.0
os-homedir,top,[DEPRECATED] Node.js `os.homedir()` ponyfill,21.6
forwarded,top,Parse HTTP X-Forwarded-For header,11.600000000000001
is-builtin-module,top,Check if a string matches the name of a Node.js builtin module,2.4000000000000004
read-pkg,top,Read a package.json file,11.600000000000001
diffie-hellman,top,pure js diffie-hellman,1.2000000000000002
expand-brackets,top,Expand POSIX bracket expressions (character classes) in glob patterns.,12.488888888888889
duplexify,top,Turn a writable and readable stream into a streams2 duplex stream with support for async initialization and streams1/streams2 input,13.915789473684212
path-is-absolute,top,Node.js 0.12 path.isAbsolute() ponyfill,11.600000000000001
is-dotfile,top,Return true if the file is (or the file path has) a dotfile.,5.2
extglob,top,Extended globs. Add (almost) the expressive power of regular expressions to glob patterns.,17.50769230769231
eslint-plugin-react,top,React-specific linting rules for ESLint,10.0
EVP_BytesToKey,top,,0.0
array-find-index,top,ES2015 `Array#findIndex()` ponyfill,14.533333333333335
encodeurl,top,"Encode a URL to a percent-encoded form, excluding already-encoded sequences",20.0
brorand,top,,0.0
date-now,top,,0.0
fs-write-stream-atomic,top,"Like `fs.createWriteStream(...)`, but atomic.",11.600000000000001
kind-of,top,"Get the native JavaScript type of a value, fast. Used by superstruct, micromatch and many others!",10.700000000000001
interpret,top,A dictionary of file extensions and associated module loaders.,16.933333333333334
os-locale,top,Get the system locale,1.6
shebang-regex,top,Regular expression for matching a shebang line,14.228571428571428
content-disposition,top,Create and parse HTTP Content-Disposition header,9.066666666666668
object-assign,top,ES2015 Object.assign() ponyfill,14.533333333333335
get-caller-file,top,,0.0
abab,top,Perfectly spec-compliant atob and btoa implementations,22.400000000000002
cli-cursor,top,Toggle the CLI cursor,1.6
center-align,top,Center-align the text in a string.,9.066666666666668
postcss-calc,top,PostCSS plugin to reduce calc(),2.0
postcss-modules-scope,top,A CSS Modules transform to extract export statements from local-scope classes,4.4
is-extendable,top,"Answers the question: ""can this value have keys?"". Returns true if a value is any of the object types: array, regexp, plain object, function or date. Useful for determining if a value is an object that can be extended.",7.251282051282051
axios,top,Promise based HTTP client for the browser and node.js,3.6
hash-base,top,abstract base class for hash-streams,2.0
get-stream,top,"Get a stream as a string, Buffer, ArrayBuffer or array",8.0
is-number,top,"JavaScript/Node.js utility. Returns `true` if the value is a number or string number. Useful for checking regex match results, user input, parsed strings, etc. ",9.8
is-path-cwd,top,Check if a path is the current working directory,8.044444444444444
is-path-in-cwd,top,Check if a path is in the current working directory,8.0
resolve-from,top,Resolve the path of a module like require.resolve() but from a given path,5.676923076923078
y18n,top,:ledger: the bare-bones i18n library used by yargs,3.2
preserve,top,"Temporarily substitute tokens in the given `string` with placeholders, then put them back after transforming the string.",16.211764705882356
path-type,top,"Check if a path is a file, directory, or symlink",8.0
proxy-addr,top,Determine address of proxied request,10.0
randomatic,top,"Easily generate random strings like passwords, with simple options for specifying a length and for using patterns of numeric, alpha-numeric, alphabetical, special or custom characters. (the original ""generate-password"")",18.45714285714286
prop-types,top,Runtime type checking for React props and similar objects,8.044444444444444
serialize-javascript,top,Serialize JavaScript to a superset of JSON that includes regular expressions and functions.,20.584615384615386
number-is-nan,top,ES2015 Number.isNaN() ponyfill,14.533333333333335
regex-cache,top,"Memoize the results of a call to the RegExp constructor, avoiding repetitious runtime compilation of the same string and options, resulting in dramatic speed improvements.",22.8
pkg-dir,top,Find the root directory of a Node.js project or npm package,5.836363636363637
isstream,top,Determine if an object is a Node.js Stream,8.200000000000001
parse-asn1,top,,0.0
alphanum-sort,top,Alphanumeric sorting algorithm,27.86666666666667
get-stdin,top,Get stdin as a string or buffer,2.8000000000000003
memory-fs,top,[DEPRECATED use memfs instead] A simple in-memory filesystem. Holds data in a javascript object.,11.371428571428572
is-finite,top,ES2015 Number.isFinite() ponyfill,14.533333333333335
is-typedarray,top,Detect whether or not an object is a Typed Array,4.0
randombytes,top,random bytes from browserify stand alone,9.066666666666668
acorn-globals,top,Use acorn to detect global variables in JavaScript,13.200000000000001
publicEncrypt,top,publicEncrypt/privateDecrypt for browserify,27.86666666666667
lazy-cache,top,"Cache requires to be lazy-loaded when needed. Uses node's own require system with tried and true, plain-vanilla JavaScript getters.",14.326315789473682
dot-prop,top,"Get, set, or delete a property from a nested object using a dot path",8.457142857142857
fetch,top,A window.fetch JavaScript polyfill.,11.600000000000001
is-equal-shallow,top,"Does a shallow comparison of two objects, returning false if the keys or values differ.",11.333333333333336
loud-rejection,top,Make unhandled promise rejections fail loudly instead of the default silent fail,11.466666666666669
mimic-fn,top,Make a function mimic another one,2.4000000000000004
callsites,top,Get callsites from the V8 stack trace API,3.2
append-transform,top,handle multiple require hooks ,21.6
is-primitive,top,Is the typeof value a javascript primitive?,14.228571428571428
object.assign,top,ES6 spec-compliant Object.assign shim. From https://github.com/es-shims/es6-shim,22.400000000000002
morgan,top,HTTP request logger middleware for node.js,9.066666666666668
path-key,top,Get the PATH environment variable key cross-platform,19.942857142857143
signal-exit,top,when you want to fire an event no matter how a process exits.,5.2
mixin-deep,top,"Deeply mix the properties of objects into the first object, while also mixing-in child objects.",8.666666666666668
ejs,top,Embedded JavaScript templates -- http://ejs.co,31.6
cache-base,top,Basic object store with methods like get/set/extend/omit,8.514285714285714
extract-text-webpack-plugin,top,[DEPRECATED] Please use https://github.com/webpack-contrib/mini-css-extract-plugin Extracts text from a bundle into a separate file,8.753846153846155
indent-string,top,Indent each line in a string,2.4000000000000004
global-prefix,top,Get the npm global path prefix. Same code used internally by npm.,5.733333333333334
espree,top,Monorepo for the JS language tools.,2.4000000000000004
class-utils,top,Utils for working with JavaScript classes and prototype methods.,12.488888888888889
collection-visit,top,"Visit a method over the items in an object, or map visit over the objects in an array. This is an alternative approach to using extend or merge, useful when events are emitted on a method like get or set.",10.0
md5.js,top,node style md5 on pure JavaScript,9.066666666666668
stream-http,top,Streaming node http in the browser,2.4000000000000004
set-value,top,Set nested properties on an object using dot-notation.,13.200000000000001
got,top,ðŸŒ Human-friendly and powerful HTTP request library for Node.js,8.200000000000001
builtin-status-codes,top,The map of HTTP status codes from the builtin http module,4.4
union-value,top,Set an array of unique values as the property of an object. Supports setting deeply nested properties using using object-paths/dot notation. Node.js/JavaScript util.,13.295652173913044
define-property,top,Define a non-enumerable property on an object.,14.228571428571428
eslint-loader,top,[DEPRECATED] A ESlint loader for webpack,9.066666666666668
test-exclude,top,test for inclusion or exclusion of paths using globs,12.488888888888889
whatwg-url,top,An implementation of the WHATWG URL Standard in JavaScript,12.488888888888889
ansi-html,top,An elegant lib that converts the chalked text to HTML.,8.0
restore-cursor,top,Gracefully restore the CLI cursor on exit,8.514285714285714
pseudomap,top,Like `new Map` but for older JavaScripts,2.8000000000000003
webidl-conversions,top,Implements the Web IDL algorithms for converting to and from JavaScript values,18.133333333333336
object.omit,top,Return a copy of an object without the given keys. ,4.0
postcss-value-parser,top,Transforms css values into the tree,2.4000000000000004
currently-unhandled,top,Track the list of currently unhandled promise rejections,18.2
node-url,top,node.js core url module as a module,2.8000000000000003
repeating,top,Repeat a string - fast,1.6
minimalistic-assert,top,,0.0
exec-sh,top,node helper to execute shell commands,9.066666666666668
spdx-correct.js,top,correct invalid SPDX identifiers,21.6
spdx-expression-parse.js,top,parse SPDX license expressions,11.600000000000001
is-accessor-descriptor,top,Returns true if a value has the characteristics of a valid JavaScript accessor descriptor.,17.02857142857143
map-obj,top,Map object keys and values into a new object,3.6
is-data-descriptor,top,Returns true if a value has the characteristics of a valid JavaScript data descriptor.,14.171428571428573
babel-plugin-dynamic-import-node,top,"Babel plugin to transpile import() to a deferred require(), for node",8.036363636363637
loose-envify,top,Like envify but much faster,10.0
miller-rabin,top,,0.0
slice-ansi,top,Slice a string with ANSI escape codes,2.8000000000000003
cli-width,top,Fallback to a default if `process.stdout.getWindowSize` doesn't exist,6.6000000000000005
source-map-url,top,[DEPRECATED] Tools for working with sourceMappingURL comments.,14.228571428571428
css-selector-tokenizer,top,Parses and stringifies CSS selectors.,10.0
path-parse,top,Node.js path.parse() ponyfill,1.2000000000000002
window-size,top,Reliable way to to get the height and width of the terminal/console in a node.js environment.,13.9
validate-npm-package-license.js,top,Give me a string and I'll tell you if it's a valid npm package license string,6.4
clap,top,Command line argument parser,11.600000000000001
minimalistic-crypto-utils,top,Minimalistic utils for JS-only crypto,10.0
map-visit,top,Map `visit` over an array of objects.,2.8000000000000003
hash.js,top,Hash functions in pure javascript,10.0
serve-index,top,Serve directory listings,14.533333333333335
nanomatch,top,"Fast, minimal glob matcher for node.js. Similar to micromatch, minimatch and multimatch, but without support for extended globs (extglobs), posix brackets or braces, and with complete Bash 4.3 wildcard support: (""*"", ""**"", and ""?"").",11.8752688172043
vary,top,Manipulate the HTTP Vary header,10.0
split-string,top,"Split a string on a given character or characters, with support for escaping.",14.430769230769233
redent,top,Strip redundant indentation and indent the string,14.228571428571428
to-object-path,top,Create an object path (dot notation) from a list or array of strings.,8.276923076923078
unset-value,top,Delete nested properties from an object using dot notation.,12.488888888888889
strip-indent,top,Strip leading whitespace from each line in a string,3.6
trim-newlines,top,Trim newlines from the start and/or end of a string,4.0
fastparse,top,"A very simple and stupid parser, based on a statemachine and regular expressions.",11.353846153846156
boxen,top,Create boxes in the terminal,10.0
bonjour,top,A Bonjour/Zeroconf protocol implementation in JavaScript,29.06666666666667
default-require-extensions,top,Node's default require extensions as a separate module,13.200000000000001
longest,top,Get the length of the longest item in an array.,4.0
write,top,"Write data to the file system, creating any intermediate directories if they don't already exist. Used by flat-cache and many others!",9.914285714285715
is-absolute-url,top,Check if a URL is absolute,9.066666666666668
file-entry-cache,top,Error: 404,0.8
table,top,Formats data into a string table.,2.4000000000000004
flat-cache,top,Error: 404,0.8
has-unicode,top,Try to guess if your terminal supports unicode,8.200000000000001
prepend-http,top,Prepend `https://` to humanized URLs like `sindresorhus.com` and `localhost`,15.133333333333335
wide-align,top,,0.0
postcss-selector-parser,top,"A CSS selector parser, integrates with postcss but does not require it.",14.8
on-headers,top,Execute a listener when a response is about to write headers.,11.672727272727274
Object.values,top,ES2017 spec-compliant shim for Object.values,18.0
prettier,top,Prettier is an opinionated code formatter.,22.400000000000002
to-regex-range,top,"Pass two numbers, get a regex-compatible source string for matching ranges. Fast compiler, optimized regex, and validated against more than 2.78 million test assertions. Useful for creating regular expressions to validate numbers, ranges, years, etc.",14.928571428571429
emoji-regex,top,A regular expression to match all Emoji-only symbols as per the Unicode Standard.,14.430769230769233
is-plain-obj,top,Check if a value is a plain object,3.2
is-svg,top,Check if a string or buffer is SVG,3.2
object-hash,top,Generate hashes from javascript objects in node and the browser.,12.0
regjsgen,top,Generate regular expressions from regjsparserâ€™s AST.,22.400000000000002
is-directory,top,"Extends `stats.isDirectory()`, returns `true` if a filepath is a directory.",12.0
detect-node,top,Detect Node.JS,0.8
cookie-parser,top,Parse HTTP request cookies,1.6
is-obj,top,Check if a value is an object,2.8000000000000003
map-cache,top,Basic cache object for storing key-value pairs. Based on MapCache in Lo-dash 3.0,5.676923076923078
is-windows,top,Returns true if the platform is Windows (and Cygwin or MSYS/MinGW for unit tests),5.6000000000000005
resolve-cwd,top,Resolve the path of a module like `require.resolve()` but from the current working directory,8.514285714285714
