library,source,description,fog_index
electron-reload,middle,Simplest (:pray:) way to reload an electron app on file changes!,8.036363636363637
git-clone,middle,Clone a git repository,11.600000000000001
autod-egg,middle,autod egg plugin,1.2000000000000002
unit.js,middle,"Simple, intuitive and flexible unit testing framework for javascript / Node.js. Integrates the great assertions libraries Must.js, Should.js, Assert of Node.js, Sinon.js and other friendly features.",12.100000000000001
web-resource-inliner,middle,"Inlines img, script and link tags into the same file",4.0
bootstrapper,middle,Sets up the default configuration for the aurelia framework and gets you up and running quick and easy.,11.644444444444446
d3-sankey,middle,Visualize flow between nodes in a directed acyclic network.,12.488888888888889
ember-test-helpers,middle,Test-framework-agnostic helpers for testing Ember.js applications,22.400000000000002
jhipster-core,middle,"JHipster Domain Language, used by JHipster UML and JDL-Studio to generate entities",14.8
url-slug,middle,"Slug generator with less than 1 KB and no dependencies, RFC 3986 compliant",14.430769230769233
encoding-down,middle,Superseded by abstract-level. An abstract-leveldown implementation that wraps another store to encode keys and values.,13.66666666666667
gulp-html5-lint,middle,gulp.js wrapper for html5-lint,1.6
bin-pack,middle,A packing algorithm for 2D bin packing. Largely based on code and a blog post by Jake Gordon.,5.822222222222223
react-mounter,middle,A simple way to mount React components ,8.514285714285714
point-geometry,middle,A standalone point geometry primitive.,18.0
fetch-ponyfill,middle,WHATWG fetch ponyfill,1.2000000000000002
beautify-lint,middle,A linter for code styling. Ensures code is written in a beautiful way.,2.6
gulp-combine-media-queries,middle,,0.0
gulp-strip-css-comments,middle,Strip comments from CSS,1.6
top-gh-contribs,middle,"A simple tool for grabbing the top contributors for a repo from github, with some convenient options.",11.505882352941178
react-dock,middle,Resizable dockable react component,21.6
base64-img,middle,"convert img to base64, or convert base64 to img",3.6
npm-utils,middle,node security project npm utilities,18.0
git-latest-semver-tag,middle,Get the most recent git semver tag of your repository,8.0
cordova-lib,middle,Apache Cordova Tooling Library,21.6
transliteration,middle,"UTF-8 to ASCII transliteration / slugify module for node.js, browser, Web Worker, React Native, Electron and CLI.",8.200000000000001
drool,middle,Automated memory leak detection and analysis,29.06666666666667
loadjs,middle,A tiny async loader / dependency manager for modern browsers (961 bytes),8.036363636363637
yargonaut,middle,:octopus: Decorate yargs content with chalk styles and figlet fonts,12.0
reInterval,middle,reschedulable setInterval for node.js,21.6
tween-one,middle,Animate One React Element,21.6
gulp-jsdoc,middle,jsDoc plugin adapter for gulp,10.0
gulp-espower,middle,Gulp plugin for power-assert,1.6
purifycss,middle,Remove unused CSS. Also works with single-page apps.,1.6
eris,middle,A NodeJS Discord library,1.6
vizion,middle,Git/Subversion/Mercurial repository metadata parser,31.6
phridge,middle,A bridge between node and PhantomJS,2.4000000000000004
gulp-clang-format,middle,,0.0
markdown-it-abbr,middle,Abbreviation (<abbr>) tag plugin for markdown-it markdown parser,13.200000000000001
npmi,middle,NodeJS package that gives a simplier API to npm install (programatically installs things),11.353846153846156
browserify-hmr,middle,Hot Module Replacement plugin for Browserify,15.733333333333334
session-file-store,middle,Session file store is a provision for storing session data in the session file,8.457142857142857
node-lintspaces,middle,A validator for checking different kinds of whitespaces in your files.,8.036363636363637
liquid-fire,middle,Animations & transitions for ambitious Ember applications.,29.06666666666667
koa-passport,middle,Passport middleware for Koa,11.600000000000001
helper-coverage,middle,Template helper for including a code coverage report generated by istanbul.,18.94545454545455
node-jwks-rsa,middle,A library to retrieve RSA public keys from a JWKS (JSON Web Key Set) endpoint.,6.0
nativescript-dev-webpack,middle,A package to help with webpacking NativeScript apps.,13.200000000000001
int64-buffer,middle,64bit Long Integer on Buffer/ArrayBuffer in Pure JavaScript,18.2
join-path,middle,"Join urls or system paths, even with undefined values.",8.044444444444444
react-grid-layout,middle,"A draggable and resizable grid layout with responsive breakpoints, for React.",11.672727272727274
meanio,middle,meanio core module,1.2000000000000002
consign,middle,Autoload your scripts.,1.2000000000000002
karma-jasmine-jquery,middle,Jasmine-jquery plugin for Jasmine in Karma,9.066666666666668
linerstream,middle,Split a readable stream by newline characters,14.228571428571428
classlist-polyfill,middle,Cross-browser element.classList,40.800000000000004
gulp-connect-php,middle,Start a php server with gulp,2.4000000000000004
gunzip-maybe,middle,Transform stream that gunzips its input if it is gzipped and just echoes it if not,6.4
js-multiaddr,middle,JavaScript implementation of multiaddr,31.6
react-sticky,middle,<Sticky /> component for awesome React apps,9.066666666666668
gulp-html-extract,middle,Extract HTML text in your gulp pipeline.,2.8000000000000003
vue-component-compiler,middle,Compile a single file Vue component into a CommonJS module.,12.0
js-peer-info,middle,libp2p Peer abstraction Node.js implementation,18.0
google-maps-react,middle,"Companion code to the ""How to Write a Google Maps React Component"" Tutorial",14.430769230769233
verb-tag-jscomments,middle,Tag for Verb. Uses js-comments to parse JavaScript code comments and generate API documentation.,14.228571428571428
OwlCarousel2,middle,DEPRECATED jQuery Responsive Carousel.,31.6
node-assetmanager,middle,A Nodejs asset manager that easily allows you to switch between development and production css and js files in your templates by managing them in a single json file that's still compatible with grunt cssmin and uglify. ,20.205405405405408
find-file-up,middle,"Find a file, starting with the given cwd and recursively searching up one directory until it's found (or we run out of directories). Async and sync.",9.815384615384616
tacks,middle,Generate fixture modules from folders,10.0
markdown-it-deflist,middle,Definition list (<dl>) tag plugin for markdown-it markdown parser ,12.488888888888889
node-rand-token,middle,Generate random token strings,11.600000000000001
NestedObjectAssign,middle,,0.0
ends-with,middle,Return `true` if a string ends with the given characters.,8.0
grunt-check-pages,middle,Grunt task that checks various aspects of a web page for correctness.,11.466666666666669
electron-squirrel-startup,middle,Default Squirrel.Windows event handler for your Electron apps.,13.200000000000001
is-type-of,middle,complete type checking for node,2.0
grunt-serve,middle,A grunt task that starts a http server that can be called to run tasks,6.0
eslint-plugin-lodash,middle,ESLint rules for lodash,1.6
react-flexbox-grid,middle,A set of React components implementing flexboxgrid with the power of CSS Modules.,11.353846153846156
aos,middle,Animate on scroll library,11.600000000000001
postcss-prefix-selector,middle,Prefix all CSS rules with a selector,8.514285714285714
prebuild,middle,A command line tool for easily doing prebuilds for multiple version of node on a specific platform,13.858823529411765
date-math,middle,simple date math module,1.6
Dexie.js,middle,A Minimalistic Wrapper for IndexedDB,18.0
clui,middle,Command Line UI toolkit for Node.js,2.4000000000000004
queue-anim,middle,Animate React Component in queue,18.0
gulp-wrapper,middle,A Gulp plugin for wrapping files with custom strings.,3.6
globstar,middle,"Run programs with glob/globstar support, especially on Windows within npm scripts.",11.672727272727274
hexo-cli,middle,Command line interface for Hexo,10.0
jstransformer-markdown-it,middle,Markdown-It support for JSTransformers.,21.6
gulp-istanbul-enforcer,middle,Gulp plugin to enforce coverage levels from istanbul coverage report,16.0
exposify,middle,browserify transform that exposes globals added via a script tag as modules so they can be required.,13.858823529411765
npm-git-info,middle,,0.0
contra,middle,:surfer: Asynchronous flow control with a functional taste to it,12.0
python-shell,middle,Run Python scripts from Node.js with simple (but efficient) inter-process communication through stdio,11.830769230769231
teamwork,middle,Wait for multiple events,11.600000000000001
vue-moment,middle,Handy Moment.js filters for your Vue.js project.,8.514285714285714
discord.js-musicbot-addon,middle,This DOES NOT WORK any more. This repo only serves as an archive for is anyone wants to pickup my work. You may still join the discord however.,3.733333333333334
spotify-web-api-node,middle,A Node.js wrapper for Spotify's Web API.,8.514285714285714
ember-assign-polyfill,middle,A polyfill for Ember.assign in <= 2.4,7.866666666666667
browser-env,middle,Simulates a global browser environment using jsdom,14.228571428571428
lines-and-columns,middle,Maps lines and columns to character offsets and back.,8.044444444444444
js-peer-id,middle,peer-id implementation in JavaScript. Deprecated; use https://github.com/libp2p/js-libp2p-peer-id instead.,21.6
cli,middle,"The Aurelia 1 command line tool. Use the CLI to create projects, scaffold components, and bundle your app for release.",8.0
package-json-versionify,middle,"Browserify transform to strip everything from package.json except for the ""version"" field.",9.066666666666668
loopback-phase,middle,Phase management for LoopBack applications.,18.0
package-deps,middle,Automatically install dependencies for your atom packages,19.942857142857143
relative,middle,"Easily calculate the relative path from file A to file B in Node.js project. Will calculate correctly from a file to a directory, file to file, directory to file, and directory to directory.",17.50909090909091
garnish,middle,:cocktail: prettifies ndjson from wzrd and similar tools,18.2
react-moment-proptypes,middle,React proptype validator for moment.js,18.0
from2-string,middle,Create a stream from a string. Sugary wrapper around from2,6.0
babel-preset-es2015-node5,middle,Babel preset to make node@5 fully ES2015 compatible,8.200000000000001
enable,middle,Detect es6 features enable or not.,9.066666666666668
titleize,middle,Capitalize every word in string: unicorn cake â†’ Unicorn Cake,16.933333333333334
crossvent,middle,:earth_asia: Cross-platform browser event handling,18.0
node-fixturify,middle,"Convert JSON objects into directory structures in the file system, and back again.",8.276923076923078
m-picker,middle,React Mobile Picker(web & react-native),21.6
react-responsive-carousel,middle,React.js Responsive Carousel (with Swipe),26.0
underscore-template-loader,middle,A Underscore and Lodash template loader for Webpack,8.200000000000001
ember-cli-github-pages,middle,Easily manage gh-pages of your ember-cli addon,14.228571428571428
blacklist,middle,"A module that shallow copies an object,  ignoring keys depending on the filter object passed to it.",11.505882352941178
react-a11y,middle,Identifies accessibility issues in your React.js elements,25.65714285714286
try-require,middle,try/require mechanism to conditionally load a module using require.,16.933333333333334
esbeautifier,middle,Simple wrapper around esformatter to beautify javascript files overriding the content of the files,14.171428571428573
jpeg-recompress-bin,middle,jpeg-recompress bin-wrapper that makes it seamlessly available as a local dependency,22.581818181818182
run-auto,middle,"Determine the best order for running async functions, LIKE MAGIC!",8.0
postcss-opacity,middle,PostCSS plugin to add opacity filter for IE8 and legacy browsers,11.672727272727274
git-repository,middle,A Promise-based JavaScript wrapper library for working with Git CLI,8.0
bili,middle,Bili makes it easier to bundle JavaScript libraries.,18.2
rc-config-loader,middle,"Load config from .{product}rc.{json,yml,js} file",10.0
unit-coverage,middle,"Precise, powerful and fast JS Coverage tool",8.514285714285714
m-date-picker,middle,React Mobile DatePicker(web & react-native),21.6
json-stringify-pretty-compact,middle,"The best of both `JSON.stringify(obj)` and `JSON.stringify(obj, null, indent)`.",10.088888888888889
redux-auth-wrapper,middle,A React Higher Order Component (HOC) for handling Authentication and Authorization with Routing and Redux,14.0
gl-vec3,middle,"gl-matrix's vec3, split into smaller pieces",2.4000000000000004
common-dir,middle,Returns the parent directory common to each path,8.200000000000001
toxic,middle,Mutate keys and values in Javascript objects,8.514285714285714
check-pages,middle,Checks various aspects of a web page for correctness.,12.488888888888889
gulp-develop-server,middle,Development assistant for node.js server by gulp,12.82857142857143
js-multihash,middle,multihash implementation in JavaScript,31.6
ice-cap,middle,IceCap - Programmable DOM-based HTML template library.,9.066666666666668
react-inline-css,middle,ðŸŒ³ Write CSS inside your React components!,9.066666666666668
help-me,middle,"Help command for node, partner of minimist and commist",3.6
copy,middle,"Copy files using glob patterns. Sync, async, promise or streams. (node.js utility)",5.733333333333334
grunt-potomo,middle,Grunt plug-in to compile .po files into binary .mo files with msgfmt.,4.933333333333334
resource-loader,middle,A middleware-style generic resource loader built with web games in mind.,11.672727272727274
spdx-license-list,middle,List of SPDX licenses,11.600000000000001
peek-stream,middle,Transform stream that lets you peek the first line before deciding how to parse it,8.666666666666668
accessory,middle,Create property accessor statements for dot paths,14.228571428571428
node-directory-tree,middle,Convert a directory tree to a JS object.,8.200000000000001
mocha.parallel,middle,Run async mocha specs in parallel,9.066666666666668
command-line-commands,middle,Add a git-like command interface to your app.,8.200000000000001
testing,middle,"Simplifies the testing of UI components by providing an elegant, fluent interface for arranging test setups along with a number of runtime debug/test helpers.",19.6
bump-cli,middle,Command-line version incrementer,27.86666666666667
npm-name,middle,Check whether a package or organization name is available on npm,11.672727272727274
gulp-base64,middle,Gulp task for converting all data found within a stylesheet (those within a url( ... ) declaration) into base64-encoded data URI strings,10.0
webpack-cleanup-plugin,middle,Plugin for webpack to cleanup the output path,3.2
react-static-container,middle,Renders static content efficiently by allowing React to short-circuit the reconciliation process.,18.133333333333336
sequence,middle,"Execute async code in chronological order. The sequence module of FuturesJS (Browser, Node.js, Bower, and Pakmanager)",9.633333333333333
react-notification-system,middle,A complete and totally customizable component for notifications in React,20.0
parse-unit,middle,"parses number and unit, '20px' into [20, 'px']",3.2
rollup-plugin-multi-entry,middle,This module has moved and is now available at @rollup/plugin-multi-entry / https://github.com/rollup/plugins/blob/master/packages/multi-entry,15.30909090909091
esformatter-quotes,middle,esformatter plugin: enforces coding style that string literals are delimited with single or double quotes,16.666666666666668
is-class,middle,Check if function is an ES6 class.,2.8000000000000003
node-manage-path,middle,This micro-lib allows you to alter the $PATH in a cross-platform way.,8.133333333333335
earl-grey,middle,Programming language compiling to JavaScript,26.0
zopflipng-bin,middle,zopflipng bin-wrapper that makes it seamlessly available as a local dependency,18.94545454545455
angular-chart.js,middle,"Reactive, responsive, beautiful charts for AngularJS using Chart.js: http://jtblin.github.io/angular-chart.js",21.37777777777778
react-quill,middle,A Quill component for React.,10.0
grunt-gulp,middle,Run gulp tasks through declarative Grunt config,8.514285714285714
superagent-promise,middle,Simple/dumb promise wrapper for superagent ,18.0
abstract-logging,middle,A noop logger interface for Node.js modules,8.514285714285714
express-react-views,middle,This is an Express view engine which renders React components on server. It renders static markup and *does not* support mounting those views on the client.,6.738461538461539
koa-helmet,middle,Important security headers for koa,10.0
framework,middle,"The Aurelia 1 framework entry point, bringing together all the required sub-modules of Aurelia.",17.02857142857143
MetaScript,middle,"Sophisticated meta programming in JavaScript, e.g. to build different versions of a library from a single source tree.",10.266666666666667
varuint-bitcoin,middle,encode/decode number as bitcoin variable length integer https://en.bitcoin.it/wiki/Protocol_documentation#Variable_length_integer,23.200000000000003
fast-json-stringify,middle,2x faster than JSON.stringify(),11.600000000000001
run-applescript,middle,Run AppleScript and get the result,9.066666666666668
gulp-pleeease,middle,Gulp plugin for postprocess CSS with ease,8.514285714285714
partialify,middle,"require()-able HTML, CSS, and (potentially) more",15.733333333333334
react-with-styles,middle,Use CSS-in-JavaScript with themes for React without being tightly coupled to one implementation,11.353846153846156
parse-torrent,middle,"Parse a torrent identifier (magnet uri, .torrent file, info hash)",6.0
prom-client,middle,Prometheus client for node.js,1.6
ngtemplate-loader,middle,Include AngularJS templates in the Webpack bundle and preload the template cache.,8.133333333333335
plexer,middle,A streams2 duplexer.,14.533333333333335
nativescript-hook,middle,Helper for installing hooks into NativeScript projects,14.228571428571428
vector-tile-js,middle,Parses vector tiles with JavaScript,10.0
babel-preset-es2015-mod,middle,"all babel es2015 plugins, with loose modules enabled",8.200000000000001
ember-sinon,middle,Ember CLI addon adding support for sinon.js,2.8000000000000003
gulp-inline-css,middle,Inline linked css in an html file. Useful for emails.,2.0
react-highcharts,middle,React wrapper for Highcharts library,2.0
mocha-fivemat-progress-reporter,middle,Mocha test reporter based on fivemat and the built in progress reporter,11.466666666666669
particles.js,middle,A lightweight JavaScript library for creating particles,19.942857142857143
atoa,middle,"Creates a true array based on `arraylike`, starting at `startIndex`.",8.0
lru-memoize,middle,A utility to provide LRU memoization for any js function,12.0
libphonenumber-js,middle,A simpler (and smaller) rewrite of Google Android's libphonenumber library in javascript,14.8
gzip-size-cli,middle,Get the gzipped size of a file or stdin,3.6
bitcoin-ops,middle,bitcoin OP codes,1.2000000000000002
grunt-protractor-coverage,middle,Coverage analysis for Protractor tests,26.0
gulp-cssbeautify,middle,Reindent and reformat CSS,11.600000000000001
find-process,middle,find process by port/pid/name etc.,18.0
karma-electron,middle,Karma launcher and preprocessor for Electron,15.733333333333334
cliclopts,middle,CLI options helper and usage printer,2.4000000000000004
machine,middle,"Function containerizer for Node.js.  (The engine behind actions2, helpers, and shell scripts in Sails.)",8.514285714285714
toml-require,middle,require() .toml files in Node.js,10.0
espower-source,middle,"Power Assert instrumentor from code to code, with SourceMap.",8.044444444444444
hapi-auth-jwt2,middle,":lock: Secure Hapi.js authentication plugin using JSON Web Tokens (JWT) in Headers, URL or Cookies",5.666666666666668
npm-prepublish,middle,Populates your module's package.json's version property from semvery git tags,14.0
contentstream,middle,"Make a readable stream by input content, content could be `String`, `Buffer`, `Object`, `Number` and so on.",9.15294117647059
xdg-trashdir,middle,Get the correct trash path on Linux,2.8000000000000003
markdown-it-table-of-contents,middle,A table of contents plugin for Markdown-it ,8.514285714285714
animator-css,middle,An implementation of the abstract Animator interface from templating which enables css-based animations.,23.661538461538463
fetchr,middle,Universal data access layer for web applications.,14.228571428571428
fuzzy-search,middle,Simple fuzzy search,1.2000000000000002
jwt,middle,Koa middleware for validating JSON Web Tokens,14.228571428571428
node-tmp-sync,middle,"The sync version of tmp just for test cases, making it much easier.",8.276923076923078
gulp-standard,middle,Standard linter for gulp,1.6
memfs,middle,JavaScript file system utilities,21.6
msgpack-lite,middle,Fast Pure JavaScript MessagePack Encoder and Decoder / msgpack.org[JavaScript],18.2
pug-cli,middle,Pug's CLI interface,14.533333333333335
Commando,middle,Official command framework for discord.js,18.0
broccoli-string-replace,middle,,0.0
eslint-config-node-style-guide,middle,ESLint shareable config version of felixge/node-style-guide,9.066666666666668
postcss-functions,middle,PostCSS plugin for exposing JavaScript functions,15.733333333333334
rework-plugin-url,middle,"url() plugin for rework, formerly included in core",13.200000000000001
actions-on-google-nodejs,middle,Node.js client library for Actions on Google,2.8000000000000003
rev-del,middle,:haircut: Delete old fingerprinted files,10.0
Node.CLI-Progress,middle, :hourglass: easy to use progress-bar for command-line/terminal applications,23.200000000000003
bossy,middle,Command line options parser,1.6
read-yaml,middle,Very thin wrapper around js-yaml for directly reading in YAML files.,8.036363636363637
rethinkdbdash,middle,"An advanced Node.js driver for RethinkDB with a connection pool, support for streams etc.",8.514285714285714
coffee,middle,Test command line on Node.js,2.0
svg4everybody,middle,Use external SVG spritemaps today,10.0
mocha-text-cov,middle,text summary of code coverage for Mocha,14.228571428571428
gulp-tape,middle,:ghost: Run Tape tests in Gulp.,2.4000000000000004
broccoli-autoprefixer,middle,Prefix CSS using Autoprefixer,11.600000000000001
buffer-indexof-polyfill,middle,This is a polyfill for Buffer#indexOf introduced in NodeJS 4.0.,8.0
karma-tap-reporter,middle,Karma plugin to report test results in TAP.,3.2
react-paginate,middle,A ReactJS component that creates a pagination,19.942857142857143
babel-plugin-precompile-charcodes,middle,Convert character code getters into plain integers.,14.228571428571428
loopback-swagger,middle,LoopBack Swagger Spec Integration,11.600000000000001
gulp-changed-in-place,middle,Gulp plugin to only pass through changed files,3.2
remove-markdown,middle,Strip Markdown stuff from text. 1.5m+ downloads / month,1.6
console.table,middle,Adds console.table method that prints an array of objects as a table in console,8.457142857142857
regextras,middle,Array extras for regular expressions,18.0
menubar,middle,âž– high level way to create menubar desktop applications with electron,12.0
swagger-jsdoc,middle,Generates swagger/openapi specification based on jsDoc comments and YAML files.,16.0
react-native-modalbox,middle,A <Modal/> component for react-native,18.0
gp-js-client,middle,JavaScript/Node.js client for Globalization Pipeline,18.0
telegraf,middle,Modern Telegram Bot Framework for Node.js,9.066666666666668
merkle-lib,middle,A performance conscious library for merkle root and tree calculations.,12.0
df,middle,Get free disk space info from `df -kP`,3.2
is-async-supported,middle,Check if async/await is available natively,15.733333333333334
versionify,middle,Browserify transform to replace placeholder with package version,13.200000000000001
mocha-eslint,middle,Run ESLint in mocha tests,2.0
normalize-newline,middle,Normalize the newline characters in a string to `\n`,12.488888888888889
dependency-injection,middle,"A lightweight,  extensible dependency injection container for JavaScript.",28.200000000000003
node-homedir,middle,Platform agnostic user home directory path resolution for Node.js.,16.933333333333334
js-sha256,middle,A simple SHA-256 / SHA-224 hash function for JavaScript supports UTF-8 encoding.,11.672727272727274
react-native-side-menu,middle,Side menu component for React Native,9.066666666666668
commonmark-react-renderer,middle,React renderer for CommonMark (rationalized Markdown),22.400000000000002
ember-browserify,middle,ember-cli addon for easily loading CommonJS packages from npm via browserify.,22.581818181818182
template-html-loader,middle,Parse templates to html loader for webpack,2.8000000000000003
auto-changelog,middle,Command line tool for generating a changelog from git tags and commit history,8.276923076923078
markdown-it-mark,middle,<mark> tag plugin for markdown-it markdown parser,8.514285714285714
pem-jwk,middle,,0.0
babel-preset-es2015-without-strict,middle,babel-preset-es2015-without-strict,40.400000000000006
bootstrap-sass-loader,middle,Webpack Loader for the Sass version Twitter Bootstrap,3.2
is-travis,middle,Check if your code is running on Travis,3.2
gulp-stylint,middle,Gulp plugin for stylus stylint linter,2.4000000000000004
postcss-css-variables,middle,PostCSS plugin to transform CSS Custom Properties(CSS variables) syntax into a static representation,14.430769230769233
google-maps-services-js,middle,Node.js client library for Google Maps API Web Services,8.044444444444444
ember-cli-deploy,middle,A deployment pipeline for Ember CLI apps,8.514285714285714
