Run,Task_Index,Source,Description,Temperature,Recommended_Library
4,1115,bottom,Maps command aliases to real commands based on a mapping.json file.,0.2,commander
4,1116,bottom,Comparative selection algorithm plugin for d-pac platform,0.2,lodash
4,1117,bottom,Node Module for comparing arrays,0.2,lodash
4,1118,bottom,Profile the language-specific libraries for Complexion,0.2,complexion-profile
4,1119,bottom,Dialog component,0.2,react-modal
4,1120,bottom,Remote / AJAX form handling à la Rails UJS,0.2,axios
4,1121,bottom,🖼 Concatenate images.,0.2,sharp
4,1122,bottom,node-http-proxy plus a REST API,0.2,http-proxy-middleware
4,1123,bottom,Error: 404,0.2,http-errors
4,1124,bottom,Node.js client library for confy API,0.2,confy-node
4,1125,bottom,A connect middleware to inject weinre script into any page.,0.2,connect-weinre
4,1126,bottom,Error: 404,0.2,express-404-handler
4,1127,bottom,NodeJS client API for Constant Contact API v2 (JSON),0.2,node-constantcontact
4,1128,bottom,"Unobtrusive, backwards compatible, syntactic sugar for Design by contract in JavaScript.",0.2,js-contracts
4,1129,bottom,Create a coreos cluster from node.js,0.2,coreos-ssh-cluster
4,1130,bottom,🍾 A trustworthy item-processing queue. Never lose data to an error again.,0.2,bullmq
4,1131,bottom,See XKCD for reference,0.2,xkcd-api
4,1132,bottom,CouchDb User Account Model ,0.2,couchdb-promises
4,1133,bottom,dead-simple command line egg-timer,0.2,node-notifier
4,1134,bottom,Simple control flow for counting callbacks,0.2,async-await-parallel
4,1135,bottom,This project contains reference implementations of Cross-Platform Authentication client library. (ETSI TS 103 407),0.2,node-webcrypto-ossl
4,1136,bottom,A crawler can use different strategy to different url pattern,0.2,node-fetch
4,1137,bottom,the node ciphers you always wanted,0.2,crypto-js
4,1138,bottom,Node.js SDK for Kazoo apis,0.2,node-kazoo-sdk
4,1139,bottom,A type-safe state management solution with atomic mutation support.,0.2,Immer
4,1140,bottom,CSS Driven Timing Library for Animations and Transitions,0.2,animejs
4,1141,bottom,A node package for css url versioner,0.2,css-url-versioner
4,1142,bottom,join two csvs by a column,0.2,csv-parser
4,1143,bottom,API testing made easy.,0.2,supertest
4,1144,bottom,WebRTC abstraction layer for cyclon.p2p WebRTC Comms implementation,0.2,simple-peer
4,1145,bottom,Star plots in d3,0.2,d3-radial-line
4,1146,bottom,Data-driven documents.,0.2,D3.js
4,1147,bottom,A small node.js module which makes it easy to subscribe to daily comic strips. Default support for Dilbert and XKCD.,0.2,node-cron
4,1148,bottom,Node.js SDK for Dailymotion API,0.2,dailymotion-api
4,1149,bottom,Módulo node.js para gerar DANFEs em .pdf,0.2,pdfkit
4,1150,bottom,A simple database sourced from csv file(s),0.2,csv-parser
4,1151,bottom,Utility to convert aneristic dates to the Discordian calendar,0.2,discordian-date-converter
4,1152,bottom,A set interval that defer the start of the next delay until the callback is executed.,0.2,p-deferred-queue
4,1153,bottom,Exceptions define library,0.2,express-async-errors
4,1154,bottom,Delighted API Node Client,0.2,delighted-node
4,1155,bottom,browserify transform for derequire,0.2,gulp-derequire
4,1156,bottom,Try to detect the type of tabular data and stream it as object stream,0.2,papaparse
4,1157,bottom,Detect file renames based on the file contents,0.2,chokidar
4,1158,bottom,"Deuces, a minimal Redis client based on ♠ Spade, specific for PubSub and Monitor mode. ",0.2,deuces
4,1159,bottom,A simple Node web local server for developments.,0.2,express
4,1160,bottom,Simple command line http server for browserify,0.2,http-server
4,1161,bottom,infinite rolling dial,0.2,react-infinite-calendar
4,1162,bottom,A node.js module for recursively reading directory and nested directories paths.,0.2,fs-extra
4,1163,bottom,efficient dirty checking for templating,0.2,fast-check
4,1164,bottom,Multipurpose client for the Backpack Displayer API,0.2,axios
4,1165,bottom,Pull a docker image from a registry using node,0.2,dockerode
4,1166,bottom,Prepares any tarball containing a project so that a docker image can be built from it.,0.2,dockerode
4,1167,bottom,Create Dockerfiles from JSON,0.2,dockerode
4,1168,bottom,Azure DocoomentDB ORM,0.2,documentdb-orm
4,1169,bottom,Doge Decimal Classification,0.2,dewey-decimal-parser
4,1170,bottom,a writable stream that replaces the innerHTML of a given dom element on writes.,0.2,dom-stream-writer
4,1171,bottom,jQuery-like DOM micro-library,0.2,umbrellajs
4,1172,bottom,ignorefile/includefile matching .gitignore spec,0.2,minimatch
4,1173,bottom,Dot-path based JavaScript object template compiler.,0.2,doT
4,1174,bottom,Download email attachments via IMAP,0.2,node-imap
4,1175,bottom,A HTTP Protocol Adapter for Droonga,0.2,droonga-http-adapter
4,1176,bottom,Returns a an array of the items in coll starting from the first item for which pred(item) returns null/undefined.,0.2,lodash
4,1177,bottom,Fetch the access token of your Dropbox Platform app from the command line,0.2,dropbox-auth-node
4,1178,bottom,Test double for Dropbox API,0.2,sinon
4,1179,bottom,Digital signature tools.,0.2,crypto-js
4,1180,bottom,Command-line tool to view the dependency tree of any module. ,0.2,npm-check
4,1181,bottom,Loader middleware for dustjs,0.2,dustjs-helpers
4,1182,bottom,A collection of converter functions to get good old JavaScript key/value objects into a DynamoDB friendly schema and back again.,0.2,dynamodb-data-types
4,1183,bottom,CipherSet 3a for telehash,0.2,telehash-js
4,1184,bottom,edp bcs command,0.2,shelljs
4,1185,bottom,Easy browsing of Open edX Modulestores,0.2,axios
4,1186,bottom,Node library for Adafruit 8x8 LED Matrix,0.2,adafruit-led-matrix
4,1187,bottom,Obfuscates e-mail addresses with x's,0.2,email-obfuscator
4,1188,bottom,Plugin for ember-cli-admin that adds multiple languages properties support,0.2,ember-i18n
4,1189,bottom,Ember CLI array slice addon,0.2,lodash
4,1190,bottom,Transpiler your ember-cli .jsx files into js,0.2,@babel/preset-react
4,1191,bottom,Ember addon for DropKick.js,0.2,ember-cli-dropkick
4,1192,bottom,An Ember Addon for PDFJS,0.2,ember-pdfjs-adapter
4,1193,bottom,Control Emic2 TTS module,0.2,emic2-tts-node
4,1194,bottom,"A lightweight, isomorphic event emitter",0.2,mitt
4,1195,bottom,Browserify tech for ENB,0.2,browserify-enb
4,1196,bottom,y-i18n routines,0.2,i18next
4,1197,bottom,Be compatible with http://engine-light.codeforamerica.org/,0.2,express-validator
4,1198,bottom,📺 Retrieve episode information from a filename,0.2,parse-torrent-title
4,1199,bottom,Epochtalk Forum Software Core Library,0.2,express
4,1200,bottom,Streamlined errors with descriptive error messages through metadata and error codes,0.2,@hapi/boom
4,1201,bottom,include `#include` extend-script file to standalone executable extend-script,0.2,`browserify`
4,1202,bottom,Universal Starter Kit to build any javascript ES6 project/library runnable in nodejs and on any browser.,0.2,webpack
4,1203,bottom,ESB nodejs driver,0.2,node-esb-connector
4,1204,bottom,A secure distributed event layer for nodejs applications,0.2,NATS Streaming Server
4,1205,bottom,A Node module to assist with pulling data out of an ESRI ArcGIS REST server into GeoJSON.,0.2,arcgis-to-geojson
4,1206,bottom,NPM package to write Gnip records to an ArcGIS Feature Service.,0.2,@esri/arcgis-rest-feature-service
4,1207,bottom,tap(tape) wrapper for testing adobe extendscript,0.2,tape-adobe-extendscript
4,1208,bottom,server-side EventSource,0.2,eventsource-node
4,1209,bottom,Developers Excuses,0.2,excuse-me
4,1210,bottom,A pluggable async cache for Node.JS,0.2,node-cache
4,1211,bottom,"Handler for Express 4 application, which allows to perform batch requests.",0.2,express-batch-handler
4,1212,bottom,A simple Express middleware to start and stop the server.,0.2,express-start-stop-server
4,1213,bottom,access logger middleware using fluentd for express.js,0.2,express-fluent-logger
4,1214,bottom,Express + ORM MVC,0.2,Sequelize
4,1215,bottom,Add a qrcode image on page on ExpressJS using Google Charts.,0.2,qrcode-generator
4,1216,bottom,Logwrangler middleware for express,0.2,morgan
4,1217,bottom,"Extract gettext strings from __('literal') and __n('single', 'plural', n ) functions in any source",0.2,gettext-parser
4,1218,bottom,Dead simple library for functional and reactive programming in JavaScript,0.2,RxJS
4,1219,bottom,A fastft posts client for the browser or node.js,0.2,fast-feed-parser
4,1220,bottom,Fauxton is the new Web UI for CouchDB,0.2,fauxton
4,1221,bottom,Slim and simple client for Facebook Graph API v2.* implemented with promises,0.2,fbgraph
4,1222,bottom,Fritbot Slack Connector,0.2,@slack/bolt
4,1223,bottom,FileBufferReader is a JavaScript library reads file and returns chunkified array-buffers. The resulting buffers can be shared using WebRTC data channels or socket.io.,0.2,readable-stream
4,1224,bottom,Ensures polite outgoing HTTP requests that respects robots.txt and aren't made too close to each other,0.2,robotstxt-parser
4,1225,bottom,quickly create an in memory index of files and their content,0.2,memfs
4,1226,bottom,指定一组目录，依次搜索指定文件（相对路径），返回其绝对文件路径，支持同步和异步方法,0.2,node-dirsync
4,1227,bottom,File to base64 using FileReader,0.2,file-base64
4,1228,bottom,Fist plugin to help to do serial executions,0.2,async-series
4,1229,bottom,JSON Fling is a simple JSON-RPC framework for NodeJS with built-in permissions and support for different transports.,0.2,json-fling
4,1230,bottom,Feature flipping and configuration using yaml files.,0.2,"""node-config-yaml"""
4,1231,bottom,is a visual editor for Dataflow programming,0.2,node-red
4,1232,bottom,Fluent validation for node.js,0.2,joi
4,1233,bottom,Build React/Flux app that runs seamlessly on both server side and client side,0.2,react-ssr-flux
4,1234,bottom,AutoBind plugin for Fluxxor to help prevent spaghetti props wiring.,0.2,fluxxor-autobind
4,1235,bottom,Font to vector path tools,0.2,fontkit
4,1236,bottom,Light wrapper around Node.js url.format() to make life a little easier,0.2,url-join
4,1237,bottom,Javascript wrapper for FRED (Federal Reserve Economic Database) API,0.2,fred-api-node
4,1238,bottom,Base stream class for FreeLoader modules,0.2,stream-js
4,1239,bottom,Fritbot: The Angriest Bot,0.2,discord.js
4,1240,bottom,Freeze an Express.js application into a set of static files,0.2,express-static-html
4,1241,bottom,:strawberry: A Node.JS ORM for both SQL and NoSQL databases,0.2,Sequelize
4,1242,bottom,Convert javascript state machine to UML diagram,0.2,xstate-viz
4,1243,bottom,Generate RFC conforming strings for an FTP server connection.,0.2,ftp-srv
4,1244,bottom,Find Firefox OS simulators in your Firefox path in NodeJS/CLI,0.2,`firefox-profile`
4,1245,bottom,Google Async Analytics using LocalStorage,0.2,universal-analytics
4,1246,bottom,frame view for loading UI into a gaffa application,0.2,gaffa-frame-view
4,1247,bottom,A Garðr plugin for Burt,0.2,gardr-burt
4,1248,bottom,Gardr plugin to resize container to content size,0.2,gardr-resize-container
4,1249,bottom,NodeJS GCM test command line interface to test gcm on your android application,0.2,node-gcm
4,1250,bottom,A node gitlab-ci-runner,0.2,node-gitlab-ci-runner
4,1251,bottom,Gearman job persistence and delayed execution system,0.2,node-gearman-job-persistence
4,1252,bottom,A GEDCOM-X Date Library for Javascript,0.2,gedcomx-date-js
4,1253,bottom,npm package for appsngen web widget generator ,0.2,appsngen-widget-generator
4,1254,bottom,"Ultra fast fullstack angular generator, using gulp.",0.2,angular-fullstack-generator
4,1255,bottom,Yeoman generator for java library,0.2,yeoman-generator-java
4,1256,bottom,Generator for meshblu connectors,0.2,meshblu-connector-generator
4,1257,bottom,Yeoman generator for NPM modules,0.2,yeoman-generator
4,1258,bottom,"A Yeoman Generator for facebook's React library. It includes gulp, browserify, livereload and famous official Twitter bootstrap Sass version",0.2,generator-react-webpack-sass
4,1259,bottom,A Yeoman generator to create a readme file,0.2,yeoman-generator
4,1260,bottom,Functions to work with JavaScript generators.,0.2,co
4,1261,bottom,Yeoman generator for video.js plugins.,0.2,generator-videojs-plugin
4,1262,bottom,High performance library for geographical map-related operations,0.2,turf
4,1263,bottom,Transform a geoJSON MultiPolygon or Polygon into a list of geohashes that form it.,0.2,geohash-poly
4,1264,bottom,Generate a plain-english summary of what is in a GeoJSON file.,0.2,@turf/turf
4,1265,bottom,Get all JS files within a directory. A simple wrapper of node-dir.,0.2,node-dir
4,1266,bottom,Yii 1/2 Packages command Node.js wrapper,0.2,yii2-nodejs-wrapper
4,1267,bottom,Export Ghost blog entries as Markdown files,0.2,gatsby-source-ghost
4,1268,bottom,Render static blog sites from Markdown using Ghost themes,0.2,gatsby-transformer-remark
4,1269,bottom,A node library to interact with the GitHub users API,0.2,octokit/rest.js
4,1270,bottom,Gitbook GrViz plugin is used to select from markdown dot and converting it into a picture format svg.,0.2,markdown-it-plugin-svgbob
4,1271,bottom,GitBook plugin : Transform comments to notes,0.2,remark-annotate
4,1272,bottom,GitBook Dictionary Plugin,0.2,gitbook-plugin-dictionary
4,1273,bottom,Piwik plugin for Gitbook,0.2,gitbook-plugin-piwik
4,1274,bottom,NPM module for Github Jobs API,0.2,github-jobs-api
4,1275,bottom,Give me a repo I'll give you the languages its written in,0.2,node-fetch
4,1276,bottom,Git hook to convert your TODOs into Github issues,0.2,husky
4,1277,bottom,ensure grep-able lines are present in your local .gitignore file,0.2,"""fs-extra"""
4,1278,bottom,Image gallery with mobile/touch support and no dependencies.,0.2,photoswipe
4,1279,bottom,Stream-based wrapper for the League of Legends API,0.2,riot-api-request
4,1280,bottom,Access http://www.go.cd API via nodeJS,0.2,axios
4,1281,bottom,GoodsCloud API client in JavaScript for Node.js,0.2,goodscloud-js-api
4,1282,bottom,Create google alerts from node.,0.2,google-alerts-api
4,1283,bottom,access bucket data from google cloud storage as a stream from node or on the cli,0.2,@google-cloud/storage
4,1284,bottom,Google Web Fonts downloader,0.2,google-fonts-parser
4,1285,bottom,Node/Meteor wrapper for googlefonts API.,0.2,google-fonts-parser
4,1286,bottom,Distributes work to local and/or remote agents,0.2,bullmq
4,1287,bottom,Grunt task for generating API documentation pages,0.2,grunt-jsdoc
4,1288,bottom,A Grunt task for generating a static blog,0.2,grunt-static-site-generator
4,1289,bottom,Compile Caveman templates using Grunt.,0.2,grunt-caveman
4,1290,bottom,Grunt plugin for accessing the CrowdIn.net API,0.2,grunt-crowdin
4,1291,bottom,Grunt plugin that renames a file with date suffix.,0.2,grunt-rename-files-by-date
4,1292,bottom,Grunt plugin for linting html using vnu.jar,0.2,grunt-html-validation
4,1293,bottom,:page_with_curl: Reporter tool to create different output formats for reports jscpd.,0.2,node-reporter
4,1294,bottom,Grunt bookshelf sync task.,0.2,grunt-bookshelf-sync
4,1295,bottom,Grunt wrapper for MetaScript preprocessor,0.2,grunt-metascript
4,1296,bottom,Manage the neo4j binary via grunt,0.2,grunt-neo4j
4,1297,bottom,Create single executable file by grunt,0.2,grunt-contrib-concat
4,1298,bottom,Grunt bindings for npm,0.2,grunt-npm
4,1299,bottom,"Plugin for Grunt, which compiles Slm to HTML",0.2,grunt-slm-html
4,1300,bottom,stylus-base-files is a node module for substituting list of base Stylus files to stylus tasks,0.2,gulp-stylus
4,1301,bottom,A template for grunt-contrib-jasmine to permit unit-testing of AMD Dojo code.,0.2,grunt-dojo-amd-testing
4,1302,bottom,Grunt plugin for building ThorJS in other patterns,0.2,grunt-thorjs-patterns
4,1303,bottom,Run xUnit tests using Grunt,0.2,grunt-contrib-jasmine
4,1304,bottom,replace refs in .css and .js file to cdn powered links,0.2,replace-in-file
4,1305,bottom,Gulp coverage reporting for Node.js that is independent of the test runner,0.2,istanbul
4,1306,bottom,Compile doTjs with gulp (gulpjs.com),0.2,gulp-dot
4,1307,bottom,Transpile ES6 modules to CommonJS with es6-module-jstransform.,0.2,@babel/core
4,1308,bottom,Turn code examples into testcases.,0.2,Jest
4,1309,bottom,Configurable dynamic install framework Bower dependencies,0.2,"""bower-installer"""
4,1310,bottom,Gulp plugin for the Haskell to JS compiler,0.2,gulp-haskell-js
4,1311,bottom,Mock plugin base on gulp.,0.2,gulp-mock-server
4,1312,bottom,perforce plugin for gulp,0.2,gulp-p4
4,1313,bottom,Provide connect-server functionality,0.2,express
4,1314,bottom,Gulp plugin to log number of source lines of code,0.2,gulp-sloc
4,1315,bottom,Define a build asset to use in an HTML comment block.,0.2,html-webpack-plugin
4,1316,bottom,Dragables extension for Hammer.js,0.2,hammerjs-plugin-draggable
4,1317,bottom,"Make promise to have support for callback API, it returns promise in that same time.",0.2,util.promisify
4,1318,bottom,Generator based handlebars style streaming templates.,0.2,handlebars-stream
4,1319,bottom,Transform Bookshelf errors into proper Boom HTTP error responses,0.2,boom-errors
4,1320,bottom,Convert hapi boom errors into jsend responses,0.2,hapi-jsend
4,1321,bottom,Hapi Bearer and JWT Authentication ,0.2,hapi-auth-jwt2
4,1322,bottom,[DEPRECATED] Hapi.js plugin to validate multipart/form-data file contents,0.2,hapi-payload-validator
4,1323,bottom,Hapi plugin for passing monit health checks,0.2,hapi-alive
4,1324,bottom,Hapi route directory ,0.2,hapi-route-directory
4,1325,bottom,Simplify your DFP business logic.,0.2,dfp.js
4,1326,bottom,"Deep-search objects for keys in JavaScript objects. Keys can be searched by providing an array of keys, or using a dot-notiation.",0.2,lodash
4,1327,bottom,NodeJS Express API Library that auto documents itself and provides additional validation,0.2,swagger-jsdoc
4,1328,bottom,Haml-like syntax transpiler for Ember HTMLBars templates,0.2,ember-cli-htmlbars-inline-precompile
4,1329,bottom,openssl Heartbleed bug(CVE-2014-0160) check for Node.js ,0.2,node-openssl-heartbleed
4,1330,bottom,proxy middleware to the Heroku API for express,0.2,http-proxy-middleware
4,1331,bottom,A library for generating vector paths for drawing the Hershey single-line font,0.2,hershey-text
4,1332,bottom,miliseconds from frequency (1000/n),0.2,ms-frequency
4,1333,bottom,:recycle: Migrate your posts from Joomla to Hexo,0.2,hexo-migrator-joomla
4,1334,bottom,Haml renderer for Hexo.,0.2,hexo-renderer-haml
4,1335,bottom,A really simple project scaffolding tool,0.2,Yeoman
4,1336,bottom,html 5 tokenizer,0.2,htmlparser2
4,1337,bottom,Encode any IP address as a haiku,0.2,haiku-ip-encoder
4,1338,bottom,Http Mock Tool,0.2,nock
4,1339,bottom,Hogan template adapter for Brisket,0.2,hogan-express
4,1340,bottom,Error: 404,0.2,http-errors
4,1341,bottom,Memory restricted hot path cache,0.2,lru-cache
4,1342,bottom,Pluggable HTML Pipeline,0.2,html-pipeline
4,1343,bottom,Knockout Templates for Node.js,0.2,knockout-template-loader
4,1344,bottom,Build HTTP request message from an object model,0.2,axios
4,1345,bottom,Wrapped `verror` with HTTP status code for Express.js,0.2,`http-errors`
4,1346,bottom,Bytes to Human bytes ,0.2,bytes.js
4,1347,bottom,Utility for using SVG images as icons on the web with pure CSS and/or DOM injection,0.2,svg.js
4,1348,bottom,ifconfig text parser,0.2,ifconfig-parser
4,1349,bottom,Bidirectional method calls API between external and iframed code.,0.2,postmate
4,1350,bottom,ify's stuff,0.2,lodash
4,1351,bottom,Image Manipulation within browser,0.2,Jimp
4,1352,bottom,A React component for responsive images in desktop and mobile browsers. Featuring Imager.js.,0.2,react-responsive-image
4,1353,bottom,"Node.js based image server with type validation, image resizing, file cache, Uniform Resource Identifier generation and also support https.",0.2,sharp
4,1354,bottom,"IMAP Server, NodeJS (based on https://github.com/andris9/hoodiecrow). As a better solution, please, see on https://github.com/wildduck-email/wildduck",0.2,wildduck-email/wildduck
4,1355,bottom,Promisified googleapis with easy access to jwt tokens,0.2,google-auth-library
4,1356,bottom,Mock IndexedDB database for testing,0.2,fake-indexeddb
4,1357,bottom,Infer a name from an email address,0.2,email-address-parser
4,1358,bottom,Injectify marionette view into Handlebars template,0.2,handlebars-injectify
4,1359,bottom,This is an in memory store used by innkeeper,0.2,node-cache
4,1360,bottom,Faster npm installs via caching whole node_module dir,0.2,npm-cache-dir
4,1361,bottom,ioBroker controller,0.2,iobroker.admin
4,1362,bottom,"Create all required icons from one icon. Right size, right file name.",0.2,"""sharp"""
4,1363,bottom,"Generate all required splash screen images from one source. Right size, right file name.",0.2,sharp
4,1364,bottom,Open input and output streams given providers and small config,0.2,`readline-sync`
4,1365,bottom,ipod,0.2,node-ipod
4,1366,bottom,[DEPRECATED] Purple isn't real,0.2,lodash
4,1367,bottom,Check if it's a ES keyword.,0.2,"""es-keywords"""
4,1368,bottom,Determine if a host is a localhost,0.2,is-localhost
4,1369,bottom,Check whether a value is a writable stream,0.2,is-writable-stream
4,1370,bottom,Error: 404,0.2,express-404-handler
4,1371,bottom,test if something is an es6 module,0.2,@babel/parser
4,1372,bottom,An HTTP request library that enables isomorphic applications.,0.2,axios
4,1373,bottom,issue tracking in hand,0.2,"""JiraClient"""
4,1374,bottom,itbit API client for node.js,0.2,itbit-api-node
4,1375,bottom,This module supplies mutual IVS conversion between Adobe-Japan and Hanyo-denshi(Moji_Joho),0.2,moji库
4,1376,bottom,"A Plugin for Jasmine, to enable jsonpath(http://goessner.net/articles/JsonPath/) in matchers",0.2,jasmine-jsonpath
4,1377,bottom,A set of matchers to assert a spy was called n times,0.2,sinon-chai
4,1378,bottom,Create Jekyll Front Matter from single markdown contents.,0.2,front-matter
4,1379,bottom,Jenny tells a remote server whats happening with your MySensors connected via a serial port,0.2,serialport
4,1380,bottom,A Browserify transform for Jison parsers.,0.2,jison-browserify
4,1381,bottom,SQL-like queries on JSON files,0.2,json-sql-query
4,1382,bottom,Generate a Joi schema from some JSON or a JS object,0.2,joi-to-json-schema
4,1383,bottom,Simple and fast number input masks,0.2,inputmask
4,1384,bottom,Plugable Node.js job queue based on the Beanstalk Job Lifecycle,0.2,bullmq
4,1385,bottom,Reusable JS abstractions,0.2,lodash
4,1386,bottom,A very easy-to-use web scrapper,0.2,cheerio
4,1387,bottom,A delta debugger for JavaScript,0.2,js-delta-debugger
4,1388,bottom,Tool to auto document ECMAScript (Java Script) in JSDoc 3 using Esprima.js.,0.2,esprima-docgen
4,1389,bottom,A reporter for gulp-jshint which produces a report compatible with Atlassian Bamboo Mocha Test Parser,0.2,gulp-mocha-bamboo-reporter
4,1390,bottom,levelup's createReadStream for a dir of json files,0.2,fs-extra
4,1391,bottom,Define REST client easily in nodejs,0.2,axios
4,1392,bottom,An AngularJS directive for rendering JSON Schema in HTML,0.2,angular-schema-form
4,1393,bottom,Data silo for digital twins in context-aware physical spaces.  We believe in an open Internet of Things.,0.2,iotdb
4,1394,bottom,Use JSON to list all elements (with css 3 and jquery selector) that you want to crawl.,0.2,cheerio
4,1395,bottom,JSOS reusable utilities with minimal dependencies.,0.2,lodash
4,1396,bottom,run bash scripts when you get a push event from a github webhook,0.2,"""node-cmd"""
4,1397,bottom,JXT definitions for Atom posts,0.2,@xmpp/jxt-atom-posts
4,1398,bottom,A humane service status API module to expose any operational/internals of any Node.js based microservice. JSON format over HTTP protocol.,0.2,express-status-monitor
4,1399,bottom,A quick an dirty karma reporter that integrates with bamboo via https://marketplace.atlassian.com/plugins/com.atlassian.bamboo.plugins.bamboo-nodejs-plugin,0.2,karma-bamboo-reporter
4,1400,bottom,chai-factories plugin for karma,0.2,karma-chai-factories
4,1401,bottom,chai-js-factories plugin for karma,0.2,karma-chai-factories
4,1402,bottom,A gzip preprocessor and plugin for Karma,0.2,karma-coverage-istanbul-reporter
4,1403,bottom,Cucumber like api for BDD styles tests using jasmine and cucumber,0.2,jasmine-cucumber
4,1404,bottom,A Karma plugin. Compile Lo-Dash templates on the fly.,0.2,karma-lodash-template-preprocessor
4,1405,bottom,Scans HTML-based server side template files for AngularJS templates and converts them to JS for use in unit tests,0.2,html-2-js-parser
4,1406,bottom,Nunjucks for Karma,0.2,karma-nunjucks-preprocessor
4,1407,bottom,Multi-Suite runner plugin for Karma,0.2,karma-parallel-runner
4,1408,bottom,"Ketch helps you execute, one way or another",0.2,node-cron
4,1409,bottom,Remaps a values from an object to specified keys,0.2,lodash
4,1410,bottom,Define states with values and kimi will drive between the states,0.2,xstate
4,1411,bottom,"create a periodical .mobi, with kindlegen",0.2,kindlegen-bin
4,1412,bottom,HTTP/2 static server,0.2,http2
4,1413,bottom,JavaScript Numeric Math Utilities,0.2,mathjs
4,1414,bottom,Knuth Morris Pratt algroithm in js,0.2,kmp-js
4,1415,bottom,"A schema builder module for knex.js, handles schema initialization and migration",0.2,knex-schema-builder
4,1416,bottom,else/elseif for Knockout,0.2,knockout-else-elseif
4,1417,bottom,A decentralized Nodejs workflow tool used to manage software on any server.,0.2,PM2
4,1418,bottom,Koa middleware for barista routing component,0.2,koa-router
4,1419,bottom,Nunjunks rendering middleware for koa,0.2,koa-nunjucks-2
4,1420,bottom,😈 Kill processes occupying a given port,0.2,fkill-cli
4,1421,bottom,Functionally handle promises,0.2,bluebird
4,1422,bottom,Automatically execute a file in a known programming language using node,0.2,child_process
4,1423,bottom,Automatically spawns a file in a known programming language using node,0.2,child_process
