Run,Task_Index,Source,Description,Temperature,Recommended_Library
2,283,top,Combine an array of streams into a single duplex stream using pump and duplexify,0.2,pumpify
2,284,top,A JS library for predictable global state management,0.2,Redux
2,285,top,Detect if the current environment is a CI server,0.2,is-ci
2,286,top,Copy files and directories with webpack,0.2,copy-webpack-plugin
2,287,top,"A tool set for CSS including fast detailed parser, walker, generator and lexer based on W3C specs and browser implementations",0.2,postcss
2,288,top,[deprecated] UglifyJS Plugin,0.2,terser-webpack-plugin
2,289,top,PostCSS plugin for css modules to local-scope classes and ids,0.2,postcss-modules
2,290,top,Small footprint URL parser that works seamlessly across Node.js and browser environments.,0.2,`url-parse`
2,291,top,"Querystringify - Small, simple but powerful query string parser.",0.2,query-string
2,292,top,Pass arbitrary constants between your module files,0.2,dotenv
2,293,top,🔀 Cross platform setting of environment scripts,0.2,cross-env
2,294,top,Search & replace tokens during the linking stage of ICSS loading,0.2,postcss-replace-token
2,295,top,Low level multicast-dns implementation in pure javascript,0.2,mdns-js
2,296,top,Sort the keys of an object,0.2,lodash
2,297,top,Return true if a file path contains the given path.,0.2,path-is-inside
2,298,top,An abstract-encoding compliant module for encoding / decoding DNS packets,0.2,dns-packet
2,299,top,Create an array with values that are present in the first input array but not additional ones,0.2,lodash.subtract
2,300,top,Node.js os.homedir polyfill for older versions of node.js.,0.2,os-homedir-polyfill
2,301,top,Get an ArrayBuffer from a Buffer as fast as possible,0.2,buffer-to-arraybuffer
2,302,top,Converting Number to Fraction with Node.js,0.2,mathjs
2,303,top,Sort CSS declarations fast and automatically in a certain order.,0.2,postcss-sorting
2,304,top,Check if a protocol requires a certain port number to be added to an URL.,0.2,url-parse
2,305,top,"Neo-Async is thought to be used as a drop-in replacement for Async, it almost fully covers its functionality and runs faster",0.2,neo-async
2,306,top,Lowercase the keys of an object,0.2,lodash
2,307,top,Use property paths (`a.b.c`) get a nested value from an object.,0.2,lodash
2,308,top,Fast line to line SourceMap generator.,0.2,`source-map`
2,309,top,"normalize a ranged value that wraps. ( i.e. angular range [0-360), where 400 === 40 and -20 === 340)",0.2,normalize-range
2,310,top,Create a relative URL with options to minify.,0.2,"""express"""
2,311,top,"Returns true if a value exists, false if empty. Works with deeply nested values using object paths.",0.2,lodash.isEmpty
2,312,top,Parse and stringify mdns service types,0.2,mdns-js
2,313,top,Get your internal IP address,0.2,internal-ip
2,314,top,Returns the directory used by NPM for globally installed NPM packages.,0.2,global-modules
2,315,top,Returns true if a value has the characteristics of a valid JavaScript descriptor. Works for data descriptors and accessor descriptors.,0.2,is-descriptor
2,316,top,Official React bindings for Redux,0.2,react-redux
2,317,top,Regular expression for matching HTML comments,0.2,html-comment-regex
2,318,top,Copies non-react specific statics from a child component to a parent component,0.2,lodash.cloneDeep
2,319,top,The Socket.IO in-memory adapter,0.2,socket.io-adapter
2,320,top,Ponyfill for Error#captureStackTrace,0.2,error-stack-parser
2,321,top,"Get a formatted timestamp. Used in gulp, assemble, generate, and many others.",0.2,moment
2,322,top,Reduce CSS calc() function at the maximum,0.2,postcss-calc
2,323,top,Get the latest version of an npm package,0.2,npm-check-updates
2,324,top,Module that helps you write generated functions in Node,0.2,plop
2,325,top,A JSONSchema validator that uses code generation to be extremely fast,0.2,ajv_codegen
2,326,top,A write stream constructor that supports a flush function that is called before finish is emitted,0.2,flush-write-stream
2,327,top,Call the given method on each value in the given object.,0.2,lodash mapValues
2,328,top,Get metadata of a package from the npm registry,0.2,npm-package-registry
2,329,top,Get the gzipped size of a string or buffer,0.2,gzip-size
2,330,top,Merge designed for webpack,0.2,webpack-merge
2,331,top,Exclude/warn on duplicated PostCSS plugins.,0.2,postcss-load-config
2,332,top,"snapdragon is an extremely pluggable, powerful and easy-to-use parser-renderer factory.",0.2,snapdragon
2,333,top,Measure the difference between two strings with the fastest JS implementation of the Levenshtein distance algorithm,0.2,fast-levenshtein
2,334,top,"Reduce function calls in a string, using a callback",0.2,lodash
2,335,top,Easily add plugin support to your node.js application. ,0.2,"""architect"""
2,336,top,Encode/decode DNS-SD TXT record RDATA fields,0.2,dns-txt-parser
2,337,top,Exports a function for slicing ArrayBuffer without polyfilling,0.2,buffer-slice
2,338,top,"Recursively (deep) clone JavaScript native types, like Object, Array, RegExp, Date as well as primitives. Used by superstruct, merge-deep, and many others!",0.2,lodash.clonedeep
2,339,top,Sourcemap support for gulpjs.,0.2,gulp-sourcemaps
2,340,top,Parses and compiles CSS nth-checks to highly optimized functions.,0.2,postcss-nth-child-optimiser
2,341,top,favicon serving middleware,0.2,serve-favicon
2,342,top,"Uses a breadth-first search, when necessary, to resolve the file path using the correct casing, and verify that the file actually exists. Returns consistent results regardless of case sensitivity of the file path and/or operating system.",0.2,find-up-case
2,343,top,Convert directories to glob compatible strings,0.2,globby
2,344,top,A collection of useful stream utility modules for writing better code using streams,0.2,"""stream-utils"""
2,345,top,Turn any collection of objects into its own efficient tree or linked list using Symbol,0.2,immer
2,346,top,PostCSS helpers to throw or output GNU style messages,0.2,postcss-reporter
2,347,top,Convert bytes to a human readable string: 1337 → 1.34 kB,0.2,bytes.js
2,348,top,Simple session middleware for Express,0.2,express-session
2,349,top,Validates whether a string matches the production for an XML name or qualified name,0.2,xml-name-validator
2,350,top,Generate the origin from an URL or check if two URL/Origins are the same.,0.2,url-parse
2,351,top,Get the real length of a string - by correctly counting astral symbols and ignoring ansi escape codes,0.2,`string-length`
2,352,top,"sane aims to be fast, small, and reliable filesystem watcher. No bells and whistles, just change events.",0.2,chokidar
2,353,top,A stricter URI encode adhering to RFC 3986,0.2,`strict-uri-encode`
2,354,top,"Lo-dash's array-clice method. Slices `array` from the `start` index up to, but not including, the `end` index.",0.2,lodash
2,355,top,Check if your code is running as an npm or yarn script,0.2,is-npm
2,356,top,A Node.js file system walker with a Readable stream interface. Extracted from fs-extra.,0.2,walk-streams
2,357,top,Load module from string,0.2,vm2
2,358,top,📦 Webpack loader for Vue.js components,0.2,vue-loader
2,359,top,"Easily add ANSI colors to your text and symbols in the terminal. ansi-colors is the official ansi styling library for gulp. Used by hundreds of projects, including enquirer, vscode, codeql, azure data studio, aws-cdk, redwoodjs, leaflet, mocha, and many others.",0.2,ansi-colors
2,360,top,Get the diff type of two semver versions: 0.0.1 0.0.2 → patch,0.2,semver-diff
2,361,top,Get XDG Base Directory paths,0.2,xdg-basedir
2,362,top,Get the set npm registry URL,0.2,npm-registry-uri
2,363,top,Use Custom Properties in CSS,0.2,postcss-custom-properties
2,364,top,Tiny utility to de-duplicate lists,0.2,lodashuniq
2,365,top,"SPDY v2, v3, v3.1 and HTTP2 transport implementation for node.js",0.2,spdy
2,366,top,ESLint Config for JavaScript Standard Style,0.2,eslint-config-standard
2,367,top,Detect if we were run as a result of `npm publish`.,0.2,is-npm-publish
2,368,top,Non-blocking stdout stream,0.2,pumpify
2,369,top,Prefix CSS,0.2,postcss-prefix-selector
2,370,top,Make your terminal beep,0.2,"""node-notifier"""
2,371,top,Get available v8 and Node.js flags.,0.2,v8-flags
2,372,top,Create the next immutable state by mutating the current one,0.2,immer
2,373,top,url.parse() with support for protocol-less URLs & IPs,0.2,url-parse
2,374,top,"Make a shallow clone of an object, array or primitive.",0.2,lodash.cloneShallow
2,375,top,Unique ID Generator,0.2,uuid
2,376,top,Import a module lazily,0.2,import-lazy
2,377,top,Flow types for the Javascript AST,0.2,@babel/types
2,378,top,BDD style assertions for node.js -- test framework agnostic,0.2,chai
2,379,top,Run some code when the process exits,0.2,on-exit
2,380,top,Get the MAC addresses (hardware addresses) of the hosts network interfaces.,0.2,os-network-interfaces
2,381,top,webpack plugin for generating asset manifests,0.2,webpack-manifest-plugin
2,382,top,Prepare a node environment to require files with different extensions.,0.2,"""esm"""
2,383,top,Parses import dependencies from a directory of sass files,0.2,sass-import-resolver
2,384,top,Determine the root path to your project,0.2,path.dirname
2,385,top,Get the visual width of the widest line in a string - the number of columns required to display it,0.2,string-width
2,386,top,Topological sorting with grouping support,0.2,graphlib
2,387,top,JS Object representation of a stack frame. ,0.2,stack-frame
2,388,top,Tiny but linear growing unique id generator.,0.2,nanoid
2,389,top,Regular expression for matching IP addresses,0.2,ip-regex
2,390,top,Merge multiple streams into one stream in sequence or parallel (~119M/month downloads).,0.2,`merge-stream`
2,391,top,Colored symbols for various log levels,0.2,chalk
2,392,top,Strip block comments or line comments from JavaScript code. ,0.2,strip-comments
2,393,top,"Convenience wrapper for ReadableStream, with an API lifted from ""from"" and ""through2""",0.2,"""readable-stream"""
2,394,top,The closest you can get to require something with bypassing the require cache,0.2,fresh
2,395,top,ES2019 spec-compliant shim for String.prototype.trimLeft.,0.2,trim-left
2,396,top,ES2019 spec-compliant shim for String.prototype.trimRight.,0.2,trim-right
2,397,top,ESlint Rules for the Standard Linter,0.2,eslint-config-standard
2,398,top,A simple javascript utility for conditionally joining classNames together,0.2,classnames
2,399,top,Parse yes/no like values,0.2,"""yes-no-words"""
2,400,top,Regular expression for matching XML NCName,0.2,xmldom
2,401,top,Additional ESLint's rules for Node.js,0.2,eslint-plugin-node
2,402,top,"Object of ""void elements"" as defined by the WHATWG HTML Standard.",0.2,void-elements
2,403,top,A Webpack plugin to optimize \ minimize CSS assets.,0.2,css-minimizer-webpack-plugin
2,404,top,Next-generation ES module bundler,0.2,esbuild
2,405,top,Run a series of dependent gulp tasks in order,0.2,run-sequence
2,406,top,"I created this in 2014, the year I learned how to program. All of the downloads are from an old version of https://github.com/micromatch/micromatch. I've done a few other things since: https://github.com/jonschlinkert.",0.2,micromatch
2,407,top,:watch: Browser shim for Node.js process.hrtime(),0.2,browser-process-hrtime
2,408,top,Global logging utility.,0.2,winston
2,409,top,A better `Stream.pipe` that creates duplex streams and lets you handle errors in one place.,0.2,`pump`
2,410,top,Node.js module to detect available ports of the system.,0.2,portscanner
2,411,top,Transform the first chunk in a stream,0.2,`stream-transform`
2,412,top,Webpack hot reloading you can attach to your own server,0.2,webpack-dev-middleware
2,413,top,⏳ Modern JavaScript date utility library ⌛️,0.2,date-fns
2,414,top,Git hooks made easy 🐶 woof!,0.2,husky
2,415,top,"Log things, prefixed with a timestamp.",0.2,log-timestamp
2,416,top,Import a module like with `require()` but from a given path,0.2,`import-fresh`
2,417,top,Thunk middleware for Redux,0.2,redux-thunk
2,418,top,A tokenzier for Sass' SCSS syntax,0.2,node-sass-parser
2,419,top,Returns true if a filepath is absolute. The original path-is-absolute.,0.2,path-is-absolute
2,420,top,NOTE: You probably want native promises now,0.2,bluebird
2,421,top,"Check if the process is running as root user, for example, one started with `sudo`",0.2,is-root
2,422,top,PostCSS plugin to fallback initial keyword,0.2,postcss-initial
2,423,top,Istanbul Instrumenter Loader,0.2,istanbul-instrumenter-loader
2,424,top,PostCSS plugin to inline at-import rules content,0.2,postcss-import-inline
2,425,top,Override HTTP verbs.,0.2,method-override
2,426,top,"Returns `true` if a file path appears to be relative. Moved from the ""relative"" lib.",0.2,is-relative-path
2,427,top,"Detect the file type of a file, stream, or data",0.2,file-type
2,428,top,the Istanbul command line interface,0.2,istanbul-cli
2,429,top,The Promised Node -- a package which promisifies the node standard library.,0.2,util.promisify
2,430,top,Import a module like with `require()` but from the current working directory,0.2,`import-local`
2,431,top,"Compare semver version strings to find which is greater, equal or lesser.",0.2,semver
2,432,top,"Recognizes certain classes of webpack errors and cleans, aggregates and prioritizes them to provide a better Developer Experience.",0.2,webpack-error-overlay
2,433,top,List of node.js builtin modules,0.2,There is no npm library needed for this task as the list of node.js builtin modules can be accessed directly from the Node.js documentation.
2,434,top,Fixing Node pipes,0.2,`pump`
2,435,top,:page_with_curl: pipe to console - process.stdout in your browser,0.2,node-fetch
2,436,top,Iterate all the data in a stream,0.2,"""through2"""
2,437,top,PostCSS plugin to transform W3C CSS font variant properties to more compatible CSS (font-feature-settings),0.2,postcss-font-variant
2,438,top,ES6 spec-compliant RegExp.prototype.flags shim,0.2,regexp.prototype.flags
2,439,top,Detect circular dependencies in modules compiled with Webpack,0.2,webpack-circular-dependency-plugin
2,440,top,A mirror of Facebook's Warning,0.2,react-toastify
2,441,top,Logger for gulp and gulp plugins.,0.2,gulp-util
2,442,top,Replaces a file extension with another one.,0.2,rename-ext
2,443,top,Regular expressions for matching against the XML Character Classes,0.2,xregexp
2,444,top,Cross-browser `CustomEvent` constructor,0.2,`custom-event-polyfill`
2,445,top,Parse a filepath and return an object of path parts. Falls back on native node.js `path.parse` if it exists ,0.2,path-parse
2,446,top,"🌟 JavaScript Style Guide, with linter & automatic code fixer",0.2,eslint-config-airbnb
2,447,top,"The power of webpack, distilled for the rest of us.",0.2,webpack-stream
2,448,top,Extend the properties from any number of objects onto the first object. Pass an empty object as the first arg to create a new object.,0.2,lodash.merge
2,449,top,Check if gulplog is available before attempting to use it,0.2,gulplog-exists
2,450,top,Get the callsite of the caller function,0.2,callsites
2,451,top,Check if something is a generator function,0.2,is-generator-fn
2,452,top,Find the closest package.json file,0.2,find-package-json
2,453,top,Serializes any DOM node into a String,0.2,serialize-dom-node
2,454,top,Is the given string an acceptable npm package name?,0.2,validate-npm-package-name
2,455,top,Let your JS API users either give you a callback or receive a promise,0.2,bluebird
2,456,top,Zip extraction written in pure JavaScript. Extracts a zip into a directory. ,0.2,adm-zip
2,457,top,Tweak React components in real time. (Deprecated: use Fast Refresh instead.),0.2,react-hot-loader
2,458,top,yet another unzip library for node,0.2,adm-zip
2,459,top,Decompress a HTTP response if needed,0.2,zlib
2,460,top,A partial implementation of the W3C URL Spec Draft for Node,0.2,url-parse
2,461,top,Apply an async function to each Array element in series,0.2,async-foreach
2,462,top,Browserify transform for Babel,0.2,babelify
2,463,top,Webpack plugin and CLI utility that represents bundle content as convenient interactive zoomable treemap,0.2,webpack-bundle-analyzer
2,464,top,Create ansi colors by passing open and close codes.,0.2,chalk
2,465,top,A tool for respawning node binaries when special flags are present.,0.2,nodemon
2,466,top,:cyclone: Use conventional text streams at the start of your gulp or vinyl pipelines,0.2,event-stream
2,467,top,Regular expression for testing if a file path is a windows UNC file path. Can also be used as a component of another regexp via the `.source` property.,0.2,"""regexp-unc-path"""
2,468,top,Remove unnecessary React propTypes from the production build. :balloon:,0.2,babel-plugin-transform-react-remove-prop-types
2,469,top,Webpack plugin for enabling Subresource Integrity.,0.2,webpack-subresource-integrity
2,470,top,Utilities for the snapdragon parser/compiler.,0.2,snapdragon
2,471,top,Fluent API for Gulp.,0.2,gulp-fluent
2,472,top,"Use Custom Media Queries in CSS, following the CSS Media Queries specification",0.2,postcss-custom-media
2,473,top,Like `extend` but only copies missing properties/values to the target object.,0.2,lodash.defaults
2,474,top,This module has moved and is now available at @rollup/plugin-node-resolve / https://github.com/rollup/plugins/blob/master/packages/node-resolve,0.2,@rollup/plugin-node-resolve
2,475,top,A module which will endeavor to guess your terminal's level of color support.,0.2,chalk
2,476,top,Writing simple and graceful Media Queries!,0.2,"""styled-components"""
2,477,top,Use Custom Selectors in CSS,0.2,postcss-custom-selectors
2,478,top,:confetti_ball: Blazing fast unique hash generator,0.2,hash-generator
2,479,top,Synchronously write a file and create its ancestor directories if needed,0.2,fs-extra
2,480,top,PostCSS plugin to transform :matches() W3C CSS pseudo class to more compatible CSS (simpler selectors),0.2,postcss-selector-matches
2,481,top,PostCSS plugin to transform :not() W3C CSS level 4 pseudo class to more compatible CSS (multiple css3 :not() selectors),0.2,postcss-selector-not
2,482,top,Find a file given a declaration of locations.,0.2,node-dir
2,483,top,Karma webpack Middleware,0.2,karma-webpack-middleware
2,484,top,🌶️ Hot reload API for Vue components,0.2,vue-hot-reload-api
2,485,top,Check if a value is a regular expression,0.2,is-regex
2,486,top,Development-only error handler middleware,0.2,express-error-handler
2,487,top,"Standalone denodeify, for all of your callback -> promise needs.  Just drop in an ES6 complaint promise library & stir",0.2,denodeify
2,488,top,"strong-globalize is built on Unicode CLDR and jquery/globalize and implements automatic extraction of strings from JS source code and HTML templates, lint the string resource, machine-translate them in seconds.  In runtime, it loads locale and string resource into memory and provides a hook to persistent logging.",0.2,strong-globalize-cli
2,489,top, A Webpack loader that enables string-based module loading with the Angular Router,0.2,@ngtools/webpack
2,490,top,Unpack a browser type and version from the useragent string,0.2,`ua-parser-js`
2,491,top,Check if the internet connection is up,0.2,is-online
2,492,top,hack into vue-loader,0.2,webpack-node-externals
2,493,top,Minifies blocks of JSON-like content into valid JSON by removing all whitespace and comments.,0.2,jsonminify
2,494,top,LoopBack passport integration to support third party logins and account linking,0.2,passport-loopback
2,495,top,Simple rollup plugin for minifying code using babel-preset-minify.,0.2,rollup-plugin-babel-minify
2,496,top,Strips comments from code,0.2,strip-comments
2,497,top,Build your commands on minimist!,0.2,minimist
2,498,top,Jade renderer for Hexo. Replaced by https://github.com/hexojs/hexo-renderer-pug,0.2,hexo-renderer-pug
2,499,top,Http assertions for should.js,0.2,chai-http
2,500,middle,Auto-generate JS class structures for Web IDL specifications,0.2,webidl2
2,501,middle,Utilities for CLI plugins,0.2,commander
2,502,middle,Common TypeScript lint rules/preferences for Ionic.,0.2,tslint-config-prettier
2,503,middle,Beautiful and accessible drag and drop for lists with React,0.2,react-beautiful-dnd
2,504,middle,Simple commandline interface to allow you to run cli or bash style commands as if you were in the terminal.,0.2,`shelljs`
2,505,middle,Beautify CSS files.,0.2,"""cssbeautify"""
2,506,middle,Utility that provides a single API for loading the content of a path/URL.,0.2,axios
2,507,middle,The up-to-date and reliable Google's libphonenumber package for node.js.,0.2,google-libphonenumber
2,508,middle,Write html files to hard disk even when using the webpack dev server or middleware,0.2,html-webpack-plugin
2,509,middle,Slice GeoJSON into vector tiles on the fly in the browser,0.2,geojson-vt
2,510,middle,Merge svgs from a folder,0.2,svg-sprite-generator
2,511,middle,Social media share buttons and share counts for React,0.2,react-share
2,512,middle,NodeJS Core Module,0.2,There is no specific npm library needed for NodeJS core modules as they are built-in modules provided by NodeJS itself.
2,513,middle,[deprecated] can be replaced with i18next-http-backend,0.2,i18next-http-backend
2,514,middle,ᕙ༼ຈل͜ຈ༽ᕗ,0.2,"There is no specific npm library that directly relates to the given task ""ᕙ༼ຈل͜ຈ༽ᕗ""."
2,515,middle,Use connect and express middleware in koa,0.2,koa-connect
2,516,middle,:dizzy: Create a modified babel preset based on an an existing preset.,0.2,@babel/preset-env
2,517,middle,Sort stream by path name using a natural sort,0.2,`natsort`
2,518,middle,"Advanced streaming http request proxy middleware for Express with support for custom routes, caching, and response transforms.",0.2,http-proxy-middleware
2,519,middle,Gulp plugin to run tasks in multiple gulpfiles,0.2,gulp-multi-fs
2,520,middle,Bitcoin Wallet Import Format JS encoding/decoding module,0.2,bip38
2,521,middle,Simple module to infer the root directory of the currently running node application,0.2,app-root-path
2,522,middle,node.js library for Xcode simctl utility on macOS,0.2,node-simctl
2,523,middle,Base tests for every PostCSS CSS parser,0.2,postcss-parser-tests
2,524,middle,Protractor screenshot reporter for Jasmine2,0.2,protractor-jasmine2-screenshot-reporter
2,525,middle,Levenshtein edit distance,0.2,fast-levenshtein
2,526,middle,"Multiple, simultaneous, individually controllable spinners for concurrent tasks in Node.js CLI programs",0.2,ora
2,527,middle,Effortless animation between DOM changes (eg. list reordering) using the FLIP technique.,0.2,react-flip-toolkit
2,528,middle,A simple React component that is resizable with a handle. ,0.2,react-resizable
2,529,middle,"Yet another changelog generator from git commits, based on conventions and with an optional hook to enforce the rules",0.2,conventional-changelog
2,530,middle,"Read a protobuf schema from the disk, parse it and resolve all imports",0.2,protobufjs
2,531,middle,"Check permissions using Shiro-like strings, put in a trie.",0.2,`trie-matcher`
2,532,middle,🐱 concatenate files,0.2,concat-files
2,533,middle,Minify images seamlessly,0.2,imagemin
2,534,middle,Wrapper for using css-inline-images in Gulp,0.2,gulp-css-image-inline
2,535,middle,"A declarative, HTML-based language that makes building web apps fun",0.2,React
2,536,middle,"Parses expressions like 1-10,20-30. Returns an energetic array.",0.2,fast-numeric-range
2,537,middle,Convert streams (readable or writable) to promises,0.2,stream-to-promise
2,538,middle,A Gulp module to push a given folder to a subtree,0.2,gulp-subtree
2,539,middle,A CLI for the node-lintspaces module.,0.2,commander
2,540,middle,"gl-matrix's mat4, split into smaller pieces",0.2,gl-mat4-partition
2,541,middle,:hamburger: An off-canvas sidebar component with a collection of effects and styles using CSS transitions and SVG path animations,0.2,hamburgers
2,542,middle,Store enhancer that syncs (a subset) of your Redux store state to localstorage.,0.2,redux-persist
2,543,middle,Simplest (:pray:) way to reload an electron app on file changes!,0.2,electron-reload
2,544,middle,Clone a git repository,0.2,nodegit
2,545,middle,autod egg plugin,0.2,egg-sequelize
2,546,middle,"Simple, intuitive and flexible unit testing framework for javascript / Node.js. Integrates the great assertions libraries Must.js, Should.js, Assert of Node.js, Sinon.js and other friendly features.",0.2,Mocha
2,547,middle,"Inlines img, script and link tags into the same file",0.2,gulp-inline-source
2,548,middle,Sets up the default configuration for the aurelia framework and gets you up and running quick and easy.,0.2,aurelia-cli
2,549,middle,Visualize flow between nodes in a directed acyclic network.,0.2,dagre-d3
2,550,middle,Test-framework-agnostic helpers for testing Ember.js applications,0.2,ember-test-helpers
2,551,middle,"JHipster Domain Language, used by JHipster UML and JDL-Studio to generate entities",0.2,jhipster-core
2,552,middle,"Slug generator with less than 1 KB and no dependencies, RFC 3986 compliant",0.2,slugify
2,553,middle,Superseded by abstract-level. An abstract-leveldown implementation that wraps another store to encode keys and values.,0.2,level-encode
2,554,middle,gulp.js wrapper for html5-lint,0.2,gulp-html5-lint
2,555,middle,A packing algorithm for 2D bin packing. Largely based on code and a blog post by Jake Gordon.,0.2,binpackingjs
2,556,middle,A simple way to mount React components ,0.2,react-router-dom
2,557,middle,A standalone point geometry primitive.,0.2,@turf/helpers
2,558,middle,WHATWG fetch ponyfill,0.2,node-fetch
2,559,middle,A linter for code styling. Ensures code is written in a beautiful way.,0.2,eslint
2,560,middle,Strip comments from CSS,0.2,strip-css-comments
2,561,middle,"A simple tool for grabbing the top contributors for a repo from github, with some convenient options.",0.2,"""octokit/rest.js"""
