Run,Task_Index,Source,Description,Temperature,Recommended_Library
3,553,middle,Superseded by abstract-level. An abstract-leveldown implementation that wraps another store to encode keys and values.,0.2,level-encoding
3,554,middle,gulp.js wrapper for html5-lint,0.2,gulp-html5-lint
3,555,middle,A packing algorithm for 2D bin packing. Largely based on code and a blog post by Jake Gordon.,0.2,bin-packing-js
3,556,middle,A simple way to mount React components ,0.2,react-router-dom
3,557,middle,A standalone point geometry primitive.,0.2,@turf/helpers
3,558,middle,WHATWG fetch ponyfill,0.2,node-fetch
3,559,middle,A linter for code styling. Ensures code is written in a beautiful way.,0.2,eslint
3,560,middle,Strip comments from CSS,0.2,strip-css-comments
3,561,middle,"A simple tool for grabbing the top contributors for a repo from github, with some convenient options.",0.2,"""octokit/rest.js"""
3,562,middle,Resizable dockable react component,0.2,react-dock-portal
3,563,middle,"convert img to base64, or convert base64 to img",0.2,"""image-to-base64"""
3,564,middle,node security project npm utilities,0.2,npm library: Node Security Platform (nsp)
3,565,middle,Get the most recent git semver tag of your repository,0.2,git-semver-tags
3,566,middle,Apache Cordova Tooling Library,0.2,cordova-lib
3,567,middle,"UTF-8 to ASCII transliteration / slugify module for node.js, browser, Web Worker, React Native, Electron and CLI.",0.2,transliteration
3,568,middle,Automated memory leak detection and analysis,0.2,memwatch-next
3,569,middle,A tiny async loader / dependency manager for modern browsers (961 bytes),0.2,scriptjs
3,570,middle,:octopus: Decorate yargs content with chalk styles and figlet fonts,0.2,yargs-unparser
3,571,middle,reschedulable setInterval for node.js,0.2,node-schedule
3,572,middle,Animate One React Element,0.2,react-spring
3,573,middle,jsDoc plugin adapter for gulp,0.2,gulp-jsdoc3
3,574,middle,Gulp plugin for power-assert,0.2,gulp-power-assert
3,575,middle,Remove unused CSS. Also works with single-page apps.,0.2,PurgeCSS
3,576,middle,A NodeJS Discord library,0.2,discord.js
3,577,middle,Git/Subversion/Mercurial repository metadata parser,0.2,nodegit
3,578,middle,A bridge between node and PhantomJS,0.2,phantomjs-node
3,579,middle,Abbreviation (<abbr>) tag plugin for markdown-it markdown parser,0.2,markdown-it-abbr
3,580,middle,NodeJS package that gives a simplier API to npm install (programatically installs things),0.2,npm-programmatic
3,581,middle,Hot Module Replacement plugin for Browserify,0.2,browserify-hmr
3,582,middle,Session file store is a provision for storing session data in the session file,0.2,express-session-file-store
3,583,middle,A validator for checking different kinds of whitespaces in your files.,0.2,eslint-plugin-no-whitespace-before-property
3,584,middle,Animations & transitions for ambitious Ember applications.,0.2,ember-animated
3,585,middle,Passport middleware for Koa,0.2,koa-passport
3,586,middle,Template helper for including a code coverage report generated by istanbul.,0.2,istanbul-reports
3,587,middle,A library to retrieve RSA public keys from a JWKS (JSON Web Key Set) endpoint.,0.2,jwks-rsa
3,588,middle,A package to help with webpacking NativeScript apps.,0.2,nativescript-dev-webpack
3,589,middle,64bit Long Integer on Buffer/ArrayBuffer in Pure JavaScript,0.2,long.js
3,590,middle,"Join urls or system paths, even with undefined values.",0.2,path-join
3,591,middle,"A draggable and resizable grid layout with responsive breakpoints, for React.",0.2,react-grid-layout
3,592,middle,meanio core module,0.2,meanio-core
3,593,middle,Autoload your scripts.,0.2,autoload
3,594,middle,Jasmine-jquery plugin for Jasmine in Karma,0.2,jasmine-jquery
3,595,middle,Split a readable stream by newline characters,0.2,split2
3,596,middle,Cross-browser element.classList,0.2,classlist-polyfill
3,597,middle,Start a php server with gulp,0.2,gulp-connect-php
3,598,middle,Transform stream that gunzips its input if it is gzipped and just echoes it if not,0.2,pumpify
3,599,middle,JavaScript implementation of multiaddr,0.2,multiaddr-js
3,600,middle,<Sticky /> component for awesome React apps,0.2,react-sticky
3,601,middle,Extract HTML text in your gulp pipeline.,0.2,gulp-html-extract
3,602,middle,Compile a single file Vue component into a CommonJS module.,0.2,vue-loader
3,603,middle,libp2p Peer abstraction Node.js implementation,0.2,libp2p-nodejs
3,604,middle,"Companion code to the ""How to Write a Google Maps React Component"" Tutorial",0.2,react-google-maps
3,605,middle,Tag for Verb. Uses js-comments to parse JavaScript code comments and generate API documentation.,0.2,jsdoc
3,606,middle,DEPRECATED jQuery Responsive Carousel.,0.2,slick-carousel
3,607,middle,A Nodejs asset manager that easily allows you to switch between development and production css and js files in your templates by managing them in a single json file that's still compatible with grunt cssmin and uglify. ,0.2,asset-manager
3,608,middle,"Find a file, starting with the given cwd and recursively searching up one directory until it's found (or we run out of directories). Async and sync.",0.2,find-up
3,609,middle,Generate fixture modules from folders,0.2,fs-extra
3,610,middle,Definition list (<dl>) tag plugin for markdown-it markdown parser ,0.2,markdown-it-deflist
3,611,middle,Generate random token strings,0.2,uuid
3,612,middle,Return `true` if a string ends with the given characters.,0.2,lodash.endswith
3,613,middle,Grunt task that checks various aspects of a web page for correctness.,0.2,grunt-htmlhint
3,614,middle,Default Squirrel.Windows event handler for your Electron apps.,0.2,electron-squirrel-startup
3,615,middle,complete type checking for node,0.2,@hapi/joi
3,616,middle,A grunt task that starts a http server that can be called to run tasks,0.2,grunt-contrib-connect
3,617,middle,ESLint rules for lodash,0.2,eslint-plugin-lodash
3,618,middle,A set of React components implementing flexboxgrid with the power of CSS Modules.,0.2,react-flexboxgrid-css-modules
3,619,middle,Animate on scroll library,0.2,AOS (Animate on Scroll)
3,620,middle,Prefix all CSS rules with a selector,0.2,postcss-prefix-selector
3,621,middle,A command line tool for easily doing prebuilds for multiple version of node on a specific platform,0.2,nvm (Node Version Manager)
3,622,middle,simple date math module,0.2,date-fns
3,623,middle,A Minimalistic Wrapper for IndexedDB,0.2,idb - a minimalistic wrapper for IndexedDB
3,624,middle,Command Line UI toolkit for Node.js,0.2,Ink
3,625,middle,Animate React Component in queue,0.2,react-transition-group
3,626,middle,A Gulp plugin for wrapping files with custom strings.,0.2,gulp-wrap
3,627,middle,"Run programs with glob/globstar support, especially on Windows within npm scripts.",0.2,cross-env
3,628,middle,Command line interface for Hexo,0.2,hexo-cli
3,629,middle,Markdown-It support for JSTransformers.,0.2,markdown-it-js-transformers
3,630,middle,Gulp plugin to enforce coverage levels from istanbul coverage report,0.2,gulp-istanbul-enforcer
3,631,middle,browserify transform that exposes globals added via a script tag as modules so they can be required.,0.2,expose-loader
3,632,middle,:surfer: Asynchronous flow control with a functional taste to it,0.2,async-await-parallel
3,633,middle,Run Python scripts from Node.js with simple (but efficient) inter-process communication through stdio,0.2,python-shell
3,634,middle,Wait for multiple events,0.2,async-await-eventemitter
3,635,middle,Handy Moment.js filters for your Vue.js project.,0.2,vue-moment
3,636,middle,This DOES NOT WORK any more. This repo only serves as an archive for is anyone wants to pickup my work. You may still join the discord however.,0.2,archive-it
3,637,middle,A Node.js wrapper for Spotify's Web API.,0.2,spotify-web-api-node
3,638,middle,A polyfill for Ember.assign in <= 2.4,0.2,ember-assign-polyfill
3,639,middle,Simulates a global browser environment using jsdom,0.2,jsdom
3,640,middle,Maps lines and columns to character offsets and back.,0.2,source-map-lookup
3,641,middle,peer-id implementation in JavaScript. Deprecated; use https://github.com/libp2p/js-libp2p-peer-id instead.,0.2,js-libp2p-peer-id
3,642,middle,"The Aurelia 1 command line tool. Use the CLI to create projects, scaffold components, and bundle your app for release.",0.2,aurelia-cli
3,643,middle,"Browserify transform to strip everything from package.json except for the ""version"" field.",0.2,browserify-package-json-version
3,644,middle,Phase management for LoopBack applications.,0.2,loopback-phase
3,645,middle,Automatically install dependencies for your atom packages,0.2,atom-package-deps
3,646,middle,"Easily calculate the relative path from file A to file B in Node.js project. Will calculate correctly from a file to a directory, file to file, directory to file, and directory to directory.",0.2,path-absolute
3,647,middle,:cocktail: prettifies ndjson from wzrd and similar tools,0.2,ndjson-cli
3,648,middle,React proptype validator for moment.js,0.2,react-moment-proptypes
3,649,middle,Create a stream from a string. Sugary wrapper around from2,0.2,through2-string
3,650,middle,Babel preset to make node@5 fully ES2015 compatible,0.2,@babel/preset-env
3,651,middle,Detect es6 features enable or not.,0.2,babel-eslint
3,652,middle,Capitalize every word in string: unicorn cake → Unicorn Cake,0.2,lodash.capitalize
3,653,middle,:earth_asia: Cross-platform browser event handling,0.2,"""cross-env"""
3,654,middle,"Convert JSON objects into directory structures in the file system, and back again.",0.2,jsonfile
3,655,middle,React Mobile Picker(web & react-native),0.2,react-native-picker-select
3,656,middle,React.js Responsive Carousel (with Swipe),0.2,react-responsive-carousel
3,657,middle,A Underscore and Lodash template loader for Webpack,0.2,lodash-webpack-plugin
3,658,middle,Easily manage gh-pages of your ember-cli addon,0.2,ember-cli-github-pages
3,659,middle,"A module that shallow copies an object,  ignoring keys depending on the filter object passed to it.",0.2,lodash.pick
3,660,middle,Identifies accessibility issues in your React.js elements,0.2,eslint-plugin-jsx-a11y
3,661,middle,try/require mechanism to conditionally load a module using require.,0.2,`import-fresh`
3,662,middle,Simple wrapper around esformatter to beautify javascript files overriding the content of the files,0.2,gulp-esformatter
3,663,middle,jpeg-recompress bin-wrapper that makes it seamlessly available as a local dependency,0.2,jpeg-recompress-bin
3,664,middle,"Determine the best order for running async functions, LIKE MAGIC!",0.2,async-sequence
3,665,middle,PostCSS plugin to add opacity filter for IE8 and legacy browsers,0.2,postcss-opacity
3,666,middle,A Promise-based JavaScript wrapper library for working with Git CLI,0.2,simple-git
3,667,middle,Bili makes it easier to bundle JavaScript libraries.,0.2,Bili
3,668,middle,"Load config from .{product}rc.{json,yml,js} file",0.2,rcloader
3,669,middle,"Precise, powerful and fast JS Coverage tool",0.2,istanbul
3,670,middle,React Mobile DatePicker(web & react-native),0.2,react-datepicker
3,671,middle,"The best of both `JSON.stringify(obj)` and `JSON.stringify(obj, null, indent)`.",0.2,`json-stringify-pretty-compact`
3,672,middle,A React Higher Order Component (HOC) for handling Authentication and Authorization with Routing and Redux,0.2,react-router-redux-auth-wrapper
3,673,middle,"gl-matrix's vec3, split into smaller pieces",0.2,lodash.chunk
3,674,middle,Returns the parent directory common to each path,0.2,path.dirname
3,675,middle,Mutate keys and values in Javascript objects,0.2,lodash
3,676,middle,Checks various aspects of a web page for correctness.,0.2,html-validator
3,677,middle,Development assistant for node.js server by gulp,0.2,gulp-eslint
3,678,middle,multihash implementation in JavaScript,0.2,multihashes
3,679,middle,IceCap - Programmable DOM-based HTML template library.,0.2,handlebars
3,680,middle,🌳 Write CSS inside your React components!,0.2,styled-components
3,681,middle,"Help command for node, partner of minimist and commist",0.2,commander
3,682,middle,"Copy files using glob patterns. Sync, async, promise or streams. (node.js utility)",0.2,"""glob"""
3,683,middle,Grunt plug-in to compile .po files into binary .mo files with msgfmt.,0.2,grunt-po2mo
3,684,middle,A middleware-style generic resource loader built with web games in mind.,0.2,resource-loader
3,685,middle,List of SPDX licenses,0.2,"""spdx-license-list"""
3,686,middle,Transform stream that lets you peek the first line before deciding how to parse it,0.2,peek-stream
3,687,middle,Create property accessor statements for dot paths,0.2,lodash
3,688,middle,Convert a directory tree to a JS object.,0.2,directory-tree
3,689,middle,Run async mocha specs in parallel,0.2,mocha-parallel-tests
3,690,middle,Add a git-like command interface to your app.,0.2,commander
3,691,middle,"Simplifies the testing of UI components by providing an elegant, fluent interface for arranging test setups along with a number of runtime debug/test helpers.",0.2,Jest
3,692,middle,Command-line version incrementer,0.2,commander
3,693,middle,Check whether a package or organization name is available on npm,0.2,npm-name
3,694,middle,Gulp task for converting all data found within a stylesheet (those within a url( ... ) declaration) into base64-encoded data URI strings,0.2,gulp-css-base64
3,695,middle,Plugin for webpack to cleanup the output path,0.2,clean-webpack-plugin
3,696,middle,Renders static content efficiently by allowing React to short-circuit the reconciliation process.,0.2,react-quickly
3,697,middle,"Execute async code in chronological order. The sequence module of FuturesJS (Browser, Node.js, Bower, and Pakmanager)",0.2,FuturesJS
3,698,middle,A complete and totally customizable component for notifications in React,0.2,react-toastify
3,699,middle,"parses number and unit, '20px' into [20, 'px']",0.2,parse-unit
3,700,middle,This module has moved and is now available at @rollup/plugin-multi-entry / https://github.com/rollup/plugins/blob/master/packages/multi-entry,0.2,@rollup/plugin-multi-entry
3,701,middle,esformatter plugin: enforces coding style that string literals are delimited with single or double quotes,0.2,esformatter-quotes
3,702,middle,Check if function is an ES6 class.,0.2,is-es6-class
3,703,middle,This micro-lib allows you to alter the $PATH in a cross-platform way.,0.2,cross-env-path
3,704,middle,Programming language compiling to JavaScript,0.2,Babel
3,705,middle,zopflipng bin-wrapper that makes it seamlessly available as a local dependency,0.2,bin-wrapper
3,706,middle,"Reactive, responsive, beautiful charts for AngularJS using Chart.js: http://jtblin.github.io/angular-chart.js",0.2,angular-chart.js
3,707,middle,A Quill component for React.,0.2,react-quill
3,708,middle,Run gulp tasks through declarative Grunt config,0.2,gulp-grunt
3,709,middle,Simple/dumb promise wrapper for superagent ,0.2,superagent-promise
3,710,middle,A noop logger interface for Node.js modules,0.2,noop-logger
3,711,middle,This is an Express view engine which renders React components on server. It renders static markup and *does not* support mounting those views on the client.,0.2,react-views-on-server
3,712,middle,Important security headers for koa,0.2,koa-helmet
3,713,middle,"The Aurelia 1 framework entry point, bringing together all the required sub-modules of Aurelia.",0.2,aurelia-bootstrapper
3,714,middle,"Sophisticated meta programming in JavaScript, e.g. to build different versions of a library from a single source tree.",0.2,babel-core
3,715,middle,encode/decode number as bitcoin variable length integer https://en.bitcoin.it/wiki/Protocol_documentation#Variable_length_integer,0.2,varint
3,716,middle,2x faster than JSON.stringify(),0.2,fast-json-stringify
3,717,middle,Run AppleScript and get the result,0.2,node-osascript
3,718,middle,Gulp plugin for postprocess CSS with ease,0.2,gulp-postcss
3,719,middle,"require()-able HTML, CSS, and (potentially) more",0.2,Parcel
3,720,middle,Use CSS-in-JavaScript with themes for React without being tightly coupled to one implementation,0.2,styled-components
3,721,middle,"Parse a torrent identifier (magnet uri, .torrent file, info hash)",0.2,parse-torrent
3,722,middle,Prometheus client for node.js,0.2,prom-client
3,723,middle,Include AngularJS templates in the Webpack bundle and preload the template cache.,0.2,angular-templatecache
3,724,middle,A streams2 duplexer.,0.2,duplexer2
3,725,middle,Helper for installing hooks into NativeScript projects,0.2,"""nativescript-hook"""
3,726,middle,Parses vector tiles with JavaScript,0.2,@mapbox/vector-tile
3,727,middle,"all babel es2015 plugins, with loose modules enabled",0.2,@babel/preset-es2015
3,728,middle,Ember CLI addon adding support for sinon.js,0.2,ember-sinon
3,729,middle,Inline linked css in an html file. Useful for emails.,0.2,inline-css
3,730,middle,React wrapper for Highcharts library,0.2,react-highcharts
3,731,middle,Mocha test reporter based on fivemat and the built in progress reporter,0.2,mocha-fivemat-progress-reporter
3,732,middle,A lightweight JavaScript library for creating particles,0.2,particles.js
3,733,middle,"Creates a true array based on `arraylike`, starting at `startIndex`.",0.2,array-slice
3,734,middle,A utility to provide LRU memoization for any js function,0.2,lru-memoize
3,735,middle,A simpler (and smaller) rewrite of Google Android's libphonenumber library in javascript,0.2,google-libphonenumber
3,736,middle,Get the gzipped size of a file or stdin,0.2,gzip-size
3,737,middle,bitcoin OP codes,0.2,bitcoin-ops
3,738,middle,Coverage analysis for Protractor tests,0.2,istanbul
3,739,middle,Reindent and reformat CSS,0.2,prettier-plugin-css
3,740,middle,find process by port/pid/name etc.,0.2,ps-list
3,741,middle,Karma launcher and preprocessor for Electron,0.2,karma-electron
3,742,middle,CLI options helper and usage printer,0.2,commander
3,743,middle,"Function containerizer for Node.js.  (The engine behind actions2, helpers, and shell scripts in Sails.)",0.2,Dockerode
3,744,middle,require() .toml files in Node.js,0.2,toml-node
3,745,middle,"Power Assert instrumentor from code to code, with SourceMap.",0.2,power-assert-runtime
3,746,middle,":lock: Secure Hapi.js authentication plugin using JSON Web Tokens (JWT) in Headers, URL or Cookies",0.2,hapi-auth-jwt2
3,747,middle,Populates your module's package.json's version property from semvery git tags,0.2,"""git-version-bump"""
3,748,middle,"Make a readable stream by input content, content could be `String`, `Buffer`, `Object`, `Number` and so on.",0.2,readable-stream
3,749,middle,Get the correct trash path on Linux,0.2,"""trash"""
3,750,middle,A table of contents plugin for Markdown-it ,0.2,markdown-it-table-of-contents
3,751,middle,An implementation of the abstract Animator interface from templating which enables css-based animations.,0.2,animejs
3,752,middle,Universal data access layer for web applications.,0.2,Sequelize
3,753,middle,Simple fuzzy search,0.2,fuzzaldrin-plus
3,754,middle,Koa middleware for validating JSON Web Tokens,0.2,koa-jwt
3,755,middle,"The sync version of tmp just for test cases, making it much easier.",0.2,tmp-sync
3,756,middle,Standard linter for gulp,0.2,gulp-eslint
3,757,middle,JavaScript file system utilities,0.2,fs-extra
3,758,middle,Fast Pure JavaScript MessagePack Encoder and Decoder / msgpack.org[JavaScript],0.2,msgpack5
3,759,middle,Pug's CLI interface,0.2,pug-cli
3,760,middle,Official command framework for discord.js,0.2,discord.js-commando
3,761,middle,ESLint shareable config version of felixge/node-style-guide,0.2,eslint-config-felixge
3,762,middle,PostCSS plugin for exposing JavaScript functions,0.2,postcss-js-functions
3,763,middle,"url() plugin for rework, formerly included in core",0.2,rework-url
3,764,middle,Node.js client library for Actions on Google,0.2,actions-on-google
3,765,middle,:haircut: Delete old fingerprinted files,0.2,rimraf
3,766,middle, :hourglass: easy to use progress-bar for command-line/terminal applications,0.2,"""cli-progress"""
3,767,middle,Command line options parser,0.2,yargs
3,768,middle,Very thin wrapper around js-yaml for directly reading in YAML files.,0.2,yamljs
3,769,middle,"An advanced Node.js driver for RethinkDB with a connection pool, support for streams etc.",0.2,rethinkdbdash
3,770,middle,Test command line on Node.js,0.2,Jest
3,771,middle,Use external SVG spritemaps today,0.2,svg-sprite-generator
3,772,middle,text summary of code coverage for Mocha,0.2,istanbul-lib-report
3,773,middle,:ghost: Run Tape tests in Gulp.,0.2,gulp-tape
3,774,middle,Prefix CSS using Autoprefixer,0.2,autoprefixer
3,775,middle,This is a polyfill for Buffer#indexOf introduced in NodeJS 4.0.,0.2,buffer-indexof
3,776,middle,Karma plugin to report test results in TAP.,0.2,karma-tap-reporter
3,777,middle,A ReactJS component that creates a pagination,0.2,react-paginate
3,778,middle,Convert character code getters into plain integers.,0.2,"""charcode"""
3,779,middle,LoopBack Swagger Spec Integration,0.2,loopback-swagger
3,780,middle,Gulp plugin to only pass through changed files,0.2,gulp-changed
3,781,middle,Strip Markdown stuff from text. 1.5m+ downloads / month,0.2,remark-strip-markdown
3,782,middle,Adds console.table method that prints an array of objects as a table in console,0.2,console-table-printer
3,783,middle,Array extras for regular expressions,0.2,lodash
3,784,middle,➖ high level way to create menubar desktop applications with electron,0.2,electron-menubar
3,785,middle,Generates swagger/openapi specification based on jsDoc comments and YAML files.,0.2,swagger-jsdoc
3,786,middle,A <Modal/> component for react-native,0.2,react-native-modal
3,787,middle,JavaScript/Node.js client for Globalization Pipeline,0.2,ibm-watson/language-translator-v3
3,788,middle,Modern Telegram Bot Framework for Node.js,0.2,telegraf
3,789,middle,A performance conscious library for merkle root and tree calculations.,0.2,merkle-tree-js
3,790,middle,Get free disk space info from `df -kP`,0.2,`diskusage`
3,791,middle,Check if async/await is available natively,0.2,es-check-runtime
3,792,middle,Browserify transform to replace placeholder with package version,0.2,browserify-replace
3,793,middle,Run ESLint in mocha tests,0.2,eslint-plugin-mocha
3,794,middle,Normalize the newline characters in a string to `\n`,0.2,normalize-newline
3,795,middle,"A lightweight,  extensible dependency injection container for JavaScript.",0.2,InversifyJS
3,796,middle,Platform agnostic user home directory path resolution for Node.js.,0.2,os-homedir
3,797,middle,A simple SHA-256 / SHA-224 hash function for JavaScript supports UTF-8 encoding.,0.2,crypto-js
3,798,middle,Side menu component for React Native,0.2,react-native-side-menu
3,799,middle,React renderer for CommonMark (rationalized Markdown),0.2,react-markdown
3,800,middle,ember-cli addon for easily loading CommonJS packages from npm via browserify.,0.2,ember-browserify
3,801,middle,Parse templates to html loader for webpack,0.2,html-loader
3,802,middle,Command line tool for generating a changelog from git tags and commit history,0.2,conventional-changelog-cli
3,803,middle,<mark> tag plugin for markdown-it markdown parser,0.2,markdown-it-mark
3,804,middle,babel-preset-es2015-without-strict,0.2,@babel/preset-env
3,805,middle,Webpack Loader for the Sass version Twitter Bootstrap,0.2,sass-loader
3,806,middle,Check if your code is running on Travis,0.2,travis-ci
3,807,middle,Gulp plugin for stylus stylint linter,0.2,gulp-stylint
3,808,middle,PostCSS plugin to transform CSS Custom Properties(CSS variables) syntax into a static representation,0.2,postcss-custom-properties
3,809,middle,Node.js client library for Google Maps API Web Services,0.2,google-maps-services-js
3,810,middle,A deployment pipeline for Ember CLI apps,0.2,ember-cli-deploy
3,811,middle,Helper for implementing advanced search features with Algolia,0.2,"""react-instantsearch"""
3,812,middle,Node.js framework for creating command line applications,0.2,Commander
3,813,middle,"Elegant, accessible toggle component for React. Also a glorified checkbox.",0.2,react-toggle-switch
3,814,middle,A sidebar component for React,0.2,react-sidebar
3,815,middle,Increment and update version in all project files,0.2,"""semver"""
3,816,middle,Yet another prepush script that will run tasks defined in a config file,0.2,husky
3,817,middle,A React.js component for using @desandro's Masonry,0.2,react-masonry-css
3,818,middle,Cross-Origin Resource Sharing(CORS) for koa,0.2,koa2-cors
3,819,middle,Parse and stringify JSON with comments. It will retain comments even when after saved!,0.2,json5
3,820,middle,A set of opinionated ESLint (http://eslint.org) rules (all rules included) tailored for React projects,0.2,eslint-plugin-react
3,821,middle,encode/decode number as bitcoin pushdata integer ,0.2,bitcoinjs-lib
3,822,middle,Temporary files and directories in Node.js,0.2,tmp-promise
3,823,middle,Core modules for the Contentful JS SDKs,0.2,contentful-management
3,824,middle,This repo isn't maintained anymore as phantomjs got dreprecated a long time ago. Please migrate to headless chrome/puppeteer.,0.2,puppeteer
3,825,middle,Grunt plugin for Sass Lint,0.2,grunt-sass-lint
3,826,middle,Clean up mocha stack traces,0.2,mocha-clean
3,827,middle,"Test suite for compliance with ECMA-262 Promise (6th Edition, Draft Specification)",0.2,mocha
3,828,middle,Seamless integration between Rollup and Istanbul,0.2,rollup-plugin-istanbul
3,829,middle,"A module to create readable `""multipart/form-data""` isomorphically in node and the browser.",0.2,`form-data`
3,830,middle,Log execution time for each plugin in a PostCSS instance.,0.2,postcss-plugin-usage-stats
3,831,middle,ESLint configurations and additional rules for me,0.2,eslint-config-airbnb
3,832,middle,"Provides boundary functions, (upper-bound and lower-bound).",0.2,lodash
3,833,middle,Allows splitting your grunt task configuration into separate files,0.2,load-grunt-config
